brand,description,price_usd,type
SAINT LAURENT,Logo-Embroidered Cotton-Cordurory Baseball Cap,550,accessories
MONTBLANC,Meisterstück Selection Leather Tote Bag,1500,accessories
SAINT LAURENT,Logo-Appliquéd Leather Pouch,375,accessories
KENZO,Boke Flower Adjustable Silver-Tone and Enamel Ring,145,accessories
SERAPIAN,Evoluzione Logo-Appliquéd Full-Grain Leather Cardholder,220,accessories
GUCCI EYEWEAR,D-Frame Two-Tone Acetate Optical Glasses,550,accessories
POLITE WORLDWIDE,"Friendship Macramé Cord, Pearl and Sterling Silver Bracelet",120,accessories
MASTER-PIECE,Potential 3Way Convertible Leather and Canvas-Trimmed CORDURA®  MasterTeX Backpack,530,accessories
BURBERRY,3.5cm Checked Cross-Grain Faux Leather Belt,480,accessories
MAISON MARGIELA,Engraved Silver Necklace,450,accessories
GUCCI,Burnished Sterling Silver Pendant Necklace,500,accessories
ANDERSON'S,3.5cm Navy Suede Belt,180,accessories
ALEXANDER MCQUEEN,Silver-Tone Chain Ring,340,accessories
KENZO,Appliquéd Logo-Embroidered Cotton-Canvas Baseball Cap,155,accessories
HATTON LABS,Heart Eternity Silver Cubic Zirconia Ring,405,accessories
DUNHILL,Rollagas Debossed Leather Briefcase,1895,accessories
ROSTERSOX,Ros Striped Ribbed Cotton-Blend Socks,35,accessories
AHLEM,Volontaires Square-Frame Acetate Sunglasses,515,accessories
SAINT LAURENT,Full-Grain Leather Holdall,4500,accessories
LOEWE,Amazona 15 Leather-Trimmed Logo-Jacquard Canvas Messenger Bag,2250,accessories
ELLIE MERCER,Small 9-Karat Gold and Resin Pendant Necklace,1295,accessories
NUDIE JEANS,Amundsson Striped Organic Cotton-Blend Socks,15,accessories
TOM FORD EYEWEAR,D-Frame Acetate Sunglasses,425,accessories
BRIONI,Tech-Jersey Baseball Cap,351,accessories
GLOBE-TROTTER,+ Dr. No Carry-On Leather-Trimmed Trolley Suitcase,2595,accessories
FENDI,Aviator-Style Logo-Print Gold-Tone and Acetate Sunglasses,520,accessories
GUCCI,Sterling Silver and Enamel Pendant Necklace,630,accessories
A.P.C.,+ JW Anderson Logo-Print Canvas Tote Bag,470,accessories
GIVENCHY,GV Speed Aviator-Style Metal Sunglasses,260,accessories
CARHARTT WIP,Heart Logo-Jaquard Ribbed Cotton-Blend Socks,25,accessories
SNOW PEAK,Breathable Quick Dry Shell Bucket Hat,80,accessories
BALENCIAGA EYEWEAR,Rectangular-Frame Acetate Sunglasses,520,accessories
PALM ANGELS,Lala Rectangular-Frame Tortoiseshell Acetate Sunglasses,275,accessories
DIOR EYEWEAR,CD Link A1U Round-Frame Silver-Tone Mirrored Sunglasses,570,accessories
ROXANNE ASSOULIN,"Silver-Tone, Faux Pearl and Enamel Beaded Necklace",90,accessories
COLLINA STRADA,3cm Embellished Crushed-Velvet Belt,250,accessories
GUCCI,Logo-Jacquard Cotton-Blend Socks,220,accessories
BALENCIAGA,Logo-Print Embossed Full-Grain Leather Cardholder,275,accessories
PEYOTE BIRD,"Hanoi Sterling Silver, Turquoise and Labradoite Beaded Bracelet",175,accessories
GUCCI,Ophidia Leather-Trimmed Monogrammed Coated-Canvas Tote Bag,1890,accessories
BOTTEGA VENETA,Intrecciato Leather Cardholder,280,accessories
OFF-WHITE,Logo-Jacquard Shell Baseball Cap,390,accessories
BALENCIAGA,Superbusy Full-Grain Leather Belt Bag,1950,accessories
CHRISTIAN LOUBOUTIN,Logo-Debossed Leather and PU Billfold Wallet,470,accessories
LOEWE,Logo-Debossed Full-Grain Leather Pouch,850,accessories
BURBERRY,Monogrammed Palladium-Plated Signet Ring,440,accessories
ACNE STUDIOS,Bernard Logo-Appliquéd Cotton-Twill Bucket Hat,180,accessories
BALENCIAGA,3.5cm Logo-Embellished Full-Grain Leather Belt,495,accessories
GIVENCHY,4G 4cm Reversible Leather Belt,445,accessories
GUCCI,Ophidia Leather and Webbing-Trimmed Monogrammed Coated-Canvas Belt Bag,1200,accessories
RAF SIMONS,+ Philippe Vandenberg Printed Canvas Tote Bag,900,accessories
OFF-WHITE,Silver-Tone Single Earring,215,accessories
GUCCI,3cm Leather Belt,490,accessories
GUCCI,Savoy Leather- and Webbing-Trimmed Monogrammed Supreme Coated-Canvas Duffle Bag,2750,accessories
MIANSAI,Wells Rhodium-Plated Silver Signet Ring,175,accessories
LE GRAMME,Triple Turn Le 11G Brushed Sterling Silver Cable Bracelet,595,accessories
DIOR EYEWEAR,InDiorO S3I Square-Frame Tortoiseshell Acetate Optical Glasses,360,accessories
TOM FORD,Pre-Tied Silk-Satin Bow Tie,290,accessories
OFF-WHITE,Virgil Square-Frame Tortoiseshell Acetate Sunglasses,330,accessories
BRUNELLO CUCINELLI,Fringed Checked Knitted Scarf,695,accessories
GUCCI,Leather- and Webbing-Trimmed Monogrammed Coated-Canvas Belt Bag,1250,accessories
LOEWE,Military XS Leather-Trimmed Canvas Messenger Bag,1650,accessories
BALENCIAGA,4cm Logo-Embellished Monogrammed Coated-Canvas Belt,495,accessories
BALENCIAGA,Logo-Print Embossed Full-Grain Leather Cardholder with Lanyard,475,accessories
ALEXANDER MCQUEEN,Accumulation Logo-Engraved Silver-Tone Ring,490,accessories
LE GRAMME,Le 28 Brushed-Ceramic Beaded Bracelet,2320,accessories
DUNHILL,Cadogan Full-Grain Leather Billfold Wallet,425,accessories
BALENCIAGA,Logo-Print Embossed Full-Grain Leather Cardholder,350,accessories
MIKIA,Silver Multi-Stone Beaded Bracelet,130,accessories
GIVENCHY,Silver-Tone and Croc-Effect Leather Chain Necklace,1055,accessories
COMME DES GARÇONS,Leather Coin Wallet,100,accessories
BURBERRY,Logo-Embroidered Leather-Trimmed Cotton-Gabardine Visor,410,accessories
GIVENCHY,Logo-Detailed Coated-Canvas and Leather Cardholder,220,accessories
ANDERSON & SHEPPARD,3.5cm Leather-Trimmed Woven Stretch-Cotton Belt,200,accessories
WTAPS®,Logo-Appliquéd Cotton-Ripstop Bucket Hat,80,accessories
FERRAGAMO,Printed Silk Tie,205,accessories
BERLUTI,Scritto Venezia Leather Billfold Wallet,760,accessories
GUCCI EYEWEAR,Aviator-Style Gold-Tone and Acetate Sunglasses,505,accessories
SAINT LAURENT EYEWEAR,Square-Frame Acetate and Silver-Tone Sunglasses,505,accessories
CELINE HOMME,Logo-Appliquéd Ribbed Wool Scarf,690,accessories
LOEWE,Logo-Appliquéd Fringed Mohair-Blend Scarf,690,accessories
LORO PIANA,Reversible Logo-Embroidered Cotton-Chambray and Linen Bucket Hat,475,accessories
BERLUTI,Scritto Venezia Leather Cardholder,410,accessories
ADIDAS CONSORTIUM,+ Wales Bonner Logo-Embroidered Striped Recycled-Knit Socks,20,accessories
KENZO,Round-Frame Metal Optical Glasses,250,accessories
GUCCI EYEWEAR,Aviator-Style Tortoiseshell Acetate Sunglasses,450,accessories
MIANSAI,Valor Silver and Onyx Single Earring,100,accessories
CUTLER AND GROSS,1378 Round-Frame Acetate Blue Light-Blocking Optical Glasses,460,accessories
BALENCIAGA,Cities Logo-Embroidered Distressed Organic Cotton-Twill Baseball Cap,425,accessories
DIOR EYEWEAR,CD SU Square-Frame Acetate and Silver-Tone Sunglasses,530,accessories
ZEGNA,Embroidered Shell Baseball Cap,390,accessories
BALENCIAGA,Logo-Print Leather Tote Bag,1450,accessories
BLEU DE CHAUFFE,Zinnia Leather-Trimmed Waxed Cotton-Canvas Tote Bag,305,accessories
GUCCI,4cm Logo-Debossed Leather Belt,450,accessories
SAINT LAURENT,Rive Gauche Leather-Trimmed Logo-Embroidered Wool-Felt Bucket Bag,1390,accessories
COMME DES GARÇONS,Leather Zip-Around Wallet,385,accessories
TOM WOOD,Orb Rhodium-Plated Ring,429,accessories
GUCCI,Leather-Trimmed Monogrammed Coated-Canvas Holdall,2450,accessories
SAINT LAURENT,Logo-Appliquéd Leather Cardholder,425,accessories
ANDERSON'S,3cm Black Leather Belt,165,accessories
ZEGNA,Logo-Embellished Leather-Trimmed Straw Hat,490,accessories
LOEWE,Logo-Detailed Leather Billfold Wallet,590,accessories
GIVENCHY,GV Day Square-Frame Marbled Acetate Sunglasses,257,accessories
PEARLS BEFORE SWINE,Silver Ring,300,accessories
DIOR EYEWEAR,DiorBlackSuit S11I D-Frame Acetate Sunglasses,490,accessories
MÉTIER,Mariner Full-Grain Leather Tote Bag,2550,accessories
LORO PIANA,Logo-Embroidered Storm System Cashmere Baseball Cap,525,accessories
ANDAFTERTHAT,+ Throwing Fits Logo-Embroidered Cotton-Twill Baseball Cap,70,accessories
BURBERRY,Logo-Embroidered Cotton-Gabardine Bucket Hat,480,accessories
CUTLER AND GROSS,1397 Square-Frame Acetate Sunglasses,560,accessories
BOTTEGA VENETA,Intrecciato Leather Belt Bag,2100,accessories
ACNE STUDIOS,Squirrel Silver-Tone and Enamel Earring,220,accessories
PORTER-YOSHIDA & CO,Force 2Way Nylon Tote Bag,430,accessories
SAINT LAURENT,Leather-Trimmed Canvas Backpack,1290,accessories
GUCCI,Silver and Enamel Ring,360,accessories
BOTTEGA VENETA,Intrecciato Leather Messenger Bag,1250,accessories
ALEXANDER MCQUEEN,4cm Reversible Leather Belt,690,accessories
MARNI,Logo-Print Canvas Tote Bag,725,accessories
BERLUTI,Fringed Scritto Cashmere-Jacquard Scarf,2160,accessories
BOTTEGA VENETA,Gold-Plated Bracelet,1300,accessories
BOTTEGA VENETA EYEWEAR,Aviator-Style Silver-Tone Sunglasses,440,accessories
DUNHILL,Ribbed Cashmere Beanie,380,accessories
KINGSMAN,+ Drake's Silk Pocket Square,65,accessories
JIYONGKIM,Sun-Faded Cotton Bucket Hat,260,accessories
FENDI,Aviator-Style Silver-Tone Sunglasses,520,accessories
ACNE STUDIOS,Logo-Appliquéd Striped Knitted Scarf,310,accessories
CDLP,10-Pack Bamboo-Blend Socks,160,accessories
GUCCI EYEWEAR,Aviator-Style Acetate Sunglasses,450,accessories
PEARLS BEFORE SWINE,Ruln Silver and Enamel Signet Ring,450,accessories
BALENCIAGA,Logo-Print Leather Backpack,1790,accessories
A.P.C.,Utilitarian Ripstop Backpack,465,accessories
POLO RALPH LAUREN,Three-Pack Striped Cotton-Blend Socks,35,accessories
SAINT LAURENT,Sac de Jour Large Full-Grain Leather Tote Bag,2950,accessories
BALENCIAGA,3.5cm Logo-Embellished Leather Belt,520,accessories
MR LEIGHT,Stahl Aviator-Style Acetate Sunglasses,675,accessories
ACNE STUDIOS,"Silver-Tone, Mother-of-Pearl and Enamel Necklace",620,accessories
BURBERRY,Checked Shell Belt Bag,760,accessories
MONTBLANC,Square-Frame Silver-Tone Sunglasses,465,accessories
MONTBLANC,Square-Frame Tortoiseshell Acetate and Gold-Tone Sunglasses,465,accessories
ALEXANDER MCQUEEN,Reversible Fringed Logo-Jacquard Wool Scarf,360,accessories
ACNE STUDIOS,Shell and Printed Leather Tote Bag,500,accessories
SID MASHBURN,2cm Leather Belt,150,accessories
MONTBLANC,Extreme 3.0 Cross-Grain Leather Billfold Wallet,330,accessories
TOM WOOD,Step Pinkie Spinel and Rhodium-Plated Silver Ring,349,accessories
GUCCI,Horsebit Cashmere-Lined Leather Gloves,730,accessories
PORTER-YOSHIDA & CO,Senses Veritcal Nylon Messenger Bag,405,accessories
PORTER-YOSHIDA & CO,Hype 2Way Nylon-Ripstop and CORDURA® Messenger Bag,450,accessories
VILEBREQUIN,Logo-Embroidered Cotton-Twill Baseball Cap,80,accessories
GIVENCHY,Logo-Appliquéd Woven Leather Pouch,1050,accessories
CELINE HOMME,Burnished Rhodium-Plated Onyx Signet Ring,940,accessories
GUCCI,G-Timeless 38mm Stainless Steel Watch,1950,accessories
PEYOTE BIRD,Pantages Gold-Plated Multi-Stone Beaded Bracelet,295,accessories
POLITE WORLDWIDE,Sterling Silver Opal Beaded Necklace,800,accessories
MONCLER,Logo-Appliquéd Ribbed Cotton Beanie,285,accessories
MR P.,Two-Tone Recycled Cotton-Blend Socks,40,accessories
SAINT LAURENT,Silver- Gold-Tone Cuff,850,accessories
OFF-WHITE,Logo-Appliquéd Ribbed Cotton and Cashmere-Blend Beanie,260,accessories
FOLK,Ash Wool-Blend Fleece Hood,75,accessories
CELINE HOMME,Cabas Triomphe Leather-Trimmed Logo-Print Coated-Canvas Tote Bag,1750,accessories
BOTTEGA VENETA EYEWEAR,Round-Frame Gold-Tone Optical Glasses,440,accessories
A.P.C.,Laure Logo-Print Denim Tote Bag,110,accessories
DUNHILL,Silver and Enamel Cufflinks,435,accessories
GLOBE-TROTTER,+ Dr. No Leather-Trimmed Vulcanised Fibreboard Storage Box,1095,accessories
CARTIER EYEWEAR,Santos Frameless Gold-Tone Sunglasses,1295,accessories
PEYOTE BIRD,Dalhalla Sterling Silver Multi-Stone Beaded Bracelet,145,accessories
SAINT LAURENT,Deco Silver-Tone Bracelet,550,accessories
BENNETT WINCH,Leather-Trimmed Cotton-Canvas Backpack,940,accessories
LOCAL AUTHORITY LA,Logo-Appliquéd Scuba and Mesh Trucker Cap,150,accessories
LORO PIANA,3.5cm Mushroom Suede Belt,565,accessories
THISISNEVERTHAT,Times Logo-Embroidered Cotton-Twill Basball Cap,45,accessories
MISSONI,Set of Three Striped Cotton-Blend Socks,150,accessories
DIOR EYEWEAR,CD Diamond S2I D-Frame Tortoiseshell Acetate and Silver-Tone Sunglasses,730,accessories
CUTLER AND GROSS,GR02 Rectangle-Frame Acetate Sunglasses,640,accessories
BENNETT WINCH,Full-Grain Leather Backpack,1600,accessories
SAINT LAURENT,Logo-Embossed Leather Tote Bag,2190,accessories
NATIVE UNION,Drop Wireless Charger,50,accessories
MONTBLANC,Sartorial Cross-Grain Leather Magnetic Cardholder,195,accessories
LORO PIANA,Damon Baby Cashmere-Lined Suede Gloves,825,accessories
TOM WOOD,Nova Rhodium-Plated Silver Cubic Zirconia Hoop Earrings,300,accessories
BURBERRY,Checked Cotton-Blend Backpack,1350,accessories
GUCCI,Logo-Engraved Silver Pendant Necklace,340,accessories
LE GRAMME,7g Polished Sterling Silver Bracelet,355,accessories
PEYOTE BIRD,"Two Oceans Silver, Turquoise and Leather Beaded Bracelet",235,accessories
SATURDAYS NYC,Abie Logo-Embroidered Cotton-Twill Baseball Cap,70,accessories
DIOR EYEWEAR,Dior B27 S2I D-Frame Acetate Sunglasses,440,accessories
GIVENCHY,Square-Frame Acetate Sunglasses,390,accessories
GUCCI,Logo-Intarsia Wool Scarf,475,accessories
MR LEIGHT,Wright Round-Frame Acetate Optical Glasses,625,accessories
REMI RELIEF,Cotton-Twill Baseball Cap,135,accessories
ARCS,Little Hey Sling Recycled-Shell Messenger Bag,270,accessories
BERLUTI,Scritto Venezia Leather and Silver-Tone Shoe Horn Key Fob,1190,accessories
GUCCI,Logo-Debossed Full-Grain Leather Belt Bag,1250,accessories
SAINT LAURENT,2cm Full-Grain Leather Belt,475,accessories
GUCCI,Silver-Tone and Enamel Bracelet,580,accessories
MONCLER,Logo-Appliquéd Leather-Trimmed Shell Backpack,940,accessories
LE GRAMME,19g Punched Ribbon Brushed Recycled Black Sterling Silver Cuff,615,accessories
BALENCIAGA,Le Cagole Embellished Textured-Leather Billfold Wallet,495,accessories
PAUL SMITH,Leather-Trimmed Jacquard Sling Backpack,455,accessories
DUNHILL,Logo-Engraved Silver-Tone Onyx Cufflinks,550,accessories
GUCCI,Ophidia Leather-Trimmed Monogrammed Coated-Canvas Belt Bag,1290,accessories
FENDI,Diagonal Aviator-Style Acetate and Silver-Tone Sunglasses,430,accessories
TOM WOOD,Mini Signet Recycled Gold Ring,1105,accessories
BALENCIAGA,Force Skate Sterling Silver Single Hoop Earring,790,accessories
BALENCIAGA EYEWEAR,Spike Acetate Sunglasses,740,accessories
FILSON,Leather-Trimmed Cotton-Canvas Baseball Cap,75,accessories
LOEWE,4cm Logo-Debossed Leather Belt,550,accessories
KIMEZE,Zuri D-Frame Acetate Sunglasses,339,accessories
MR P.,+ Cubitts Herbrand Round-Frame Acetate Sunglasses,180,accessories
BEAMS PLUS,Ribbed Wool Beanie,80,accessories
SAINT LAURENT,Silver-Tone Crystal Clip Earrings,395,accessories
KAPITAL,Pueblo Silver-Tone Beaded Ear Cuff,140,accessories
ALEXANDER MCQUEEN,Fine Accumulation Silver-Tone Cuff,590,accessories
SAINT LAURENT,Fringed paisley-print modal and cashmere-blend scarf,750,accessories
MONTBLANC,Square-Frame Acetate Sunglasses,425,accessories
MASTER-PIECE,Mini Leather-Trimmed Colour-Block Canvas Pet Tote Bag,175,accessories
CELINE HOMME,Studded Webbing-Trimmed Goggles,630,accessories
THE ELDER STATESMAN,Parker Ribbed Cashmere Beanie,495,accessories
LOEWE,Logo-Embroidered Ribbed Wool Beanie,350,accessories
BRUNELLO CUCINELLI EYEWEAR,+ Oliver Peoples Aviator-Style Gold-Tone Sunglasses,699,accessories
ENFANTS RICHES DÉPRIMÉS,Sterling Silver Bracelet,710,accessories
THISISNEVERTHAT,Onyx Logo-Embroidered Baseball Cap,45,accessories
ALICE MADE THIS,Rhodium-Plated Sterling Silver Chain Necklace,90,accessories
SAINT LAURENT EYEWEAR,Round-Frame Tortoiseshell Acetate Optical Glasses,460,accessories
GUCCI,Logo-Appliquéd Ribbed Cashmere Leg Warmers,1165,accessories
MONTBLANC,Meisterstück Leather Cardholder,180,accessories
ÉLIOU,Cam Gold-Plated Freshwater Pearl Bracelet,142,accessories
BURBERRY,Logo-Embroidered Denim Baseball Cap,480,accessories
BALENCIAGA,Logo-Print Croc-Effect Leather Billfold Wallet,475,accessories
WACKO MARIA,+ Speakeasy Packable Snake-Print Mesh Tote Bag,60,accessories
BURBERRY,Logo-Engraved Palladium-Plated Signet Ring,380,accessories
GUCCI EYEWEAR,Round-Frame Silver and Gold-Tone Sunglasses,595,accessories
MISSONI,7cm Silk-Jacquard Tie,110,accessories
JACQUES MARIE MAGE,Devoto Rectangular-Frame Acetate and Silver-Tone Sunglasses,595,accessories
GUCCI,Leather-Trimmed Logo-Jacquard Shearling Belt Bag,2600,accessories
GIVENCHY,Logo-Embossed Leather Billfold Wallet,340,accessories
BURBERRY,Leather-Trimmed Checked Coated-Canvas Messenger Bag,1000,accessories
GIVENCHY,Essential U Logo-Embroidered Nylon Backpack,1100,accessories
GUCCI,4cm Logo-Embellished Leather Belt,420,accessories
CELINE HOMME,Triomphe Logo-Print Coated-Canvas Pouch,350,accessories
GALLERY DEPT.,ATK Embroidered Cotton-Twill Baseball Cap,210,accessories
LOEWE,+ Paula's Ibiza Round-Frame Acetate Sunglasses,380,accessories
BALENCIAGA,Logo-Print Embossed Full-Grain Leather Messenger Bag,895,accessories
MR LEIGHT,Billie Round-Frame Titanium and Acetate Sunglasses,695,accessories
MONTBLANC,Montblanc Extreme 3.0 Cross-Grain Leather Zipped Cardholder,290,accessories
ALEXANDER MCQUEEN,Skull Engraved Silver-Tone Ring,490,accessories
GUCCI,4cm Leather-Trimmed Monogrammed Coated-Canvas Belt,480,accessories
BLEU DE CHAUFFE,Bazar Leather-Trimmed Printed Cotton-Blend Canvas Tote Bag,250,accessories
PAUL SMITH,Striped Cotton-Blend Socks,30,accessories
CHRISTIAN LOUBOUTIN,Loubishark Rubber and Silver-Tone Keyring,250,accessories
LOEWE,Coin Printed Full-Grain Leather Zip-Around Cardholder,490,accessories
CHRISTIAN LOUBOUTIN,Logo-Appliquéd Full-Grain Leather Billfold Wallet,420,accessories
LORO PIANA,4cm Cotton-Blend Corduroy and Leather Belt,515,accessories
DENTS,Shaftesbury Touchscreen Cashmere-Lined Leather Gloves,110,accessories
LORO PIANA,3cm Nubuck Belt,595,accessories
AHLEM,Villette Rectangle-Frame Acetate Sunglasses,500,accessories
POLITE WORLDWIDE,"Sterling Silver, Pearl and Enemal Necklace",700,accessories
GUCCI,G-Timeless Automatic 40mm Stainless Steel Watch,2100,accessories
SAINT LAURENT,Fringed Cashmere Scarf,650,accessories
SMYTHSON,Panama Cross-Grain Leather Cardholder,185,accessories
BURBERRY,4cm Reversible Checked E-Canvas and Leather Belt,580,accessories
GARRETT LEIGHT CALIFORNIA OPTICAL,Ruskin 48 D-Frame Tortoiseshell Acetate Optical Glasses,355,accessories
LE GRAMME,7g Recycled Sterling Silver Bracelet,550,accessories
GIVENCHY,4G 4cm Reversible Coated-Canvas and Leather Belt,420,accessories
TOM WOOD,Box Rhodium-Plated Chain Bracelet,200,accessories
PORTER-YOSHIDA & CO,Counter Shade Camouflage-Print Nylon Pouch,450,accessories
PAUL SMITH,Embossed Leather Backpack,825,accessories
CARHARTT WIP,Logo-Appliquéd Cotton-Canvas Baseball Cap,80,accessories
KAPITAL,"Kountry Patchwork Printed Voile, Gauze, Tweed and Felt Scarf",595,accessories
MIKIA,Silver and Hematite Beaded Necklace,325,accessories
MIANSAI,Level Sterling Silver Topaz Ring,250,accessories
GUCCI,Savoy Leather and Webbing-Trimmed Monogrammed Coated-Canvas Duffle Bag,2450,accessories
MR P.,Cotton-Blend Piqué Socks,40,accessories
BOTTEGA VENETA,Intrecciato Leather Wallet,1000,accessories
PALM ANGELS,Cotton-Twill Baseball Cap,240,accessories
BENNETT WINCH,Full-Grain Leather Briefcase,1950,accessories
GUCCI,Leather-Trimmed Monogrammed Coated-Canvas Messenger Bag,1690,accessories
BRUNELLO CUCINELLI EYEWEAR,Griffo Acetate Sunglasses,647,accessories
DIOR EYEWEAR,CD Diamond A1U Aviator-Style Silver-Tone and Tortoiseshell Acetate Sunglasses,780,accessories
FENDI,Bilayer Square-Frame Acetate Sunglasses,390,accessories
JACQUES MARIE MAGE,+ Umit Benan Hulya Oval-Frame Tortoiseshell Acetate Sunglasses,895,accessories
ALEXANDER MCQUEEN,Gaze Logo-Engraved Silver-Tone Ear Cuff,350,accessories
NEIGHBORHOOD,ID Printed Cotton-Twill Tote Bag,50,accessories
ROSTERSOX,Ribbed Intarsia Cotton-Blend Socks,35,accessories
GUCCI,Fringed Logo-Jacquard Cashmere Scarf,945,accessories
COMME DES GARÇONS,3cm Logo-Print Leather Belt,150,accessories
POLO RALPH LAUREN,Logo-Embroidered Cotton-Twill Baseball Cap,45,accessories
SERAPIAN,North South Full-Grain Leather Messenger Bag,790,accessories
MIANSAI,Annex Sterling Silver and Cord Bracelet,55,accessories
ALICE MADE THIS,Dog Tag Sterling Silver and Stainless Steel Necklace,225,accessories
HESTRA,Jake Wool-Lined Leather Gloves,160,accessories
LORO PIANA,Leather-Trimmed Suede and Shearling Gloves,1200,accessories
SAINT LAURENT,Noe Logo-Embossed Leather Tote Bag,2390,accessories
BOTTEGA VENETA,Intrecciato Full-Grain Leather Billfold Wallet,650,accessories
BOTTEGA VENETA EYEWEAR,Rectangular-Frame Acetate Sunglasses,690,accessories
LOEWE,Puzzle Logo-Debossed Leather Bifold Wallet,550,accessories
GUCCI,Leather-Trimmed Monogrammed Coated-Canvas Belt Bag,1190,accessories
ALEXANDER MCQUEEN,Harness Faux Leather-Trimmed Canvas Messenger Bag,1090,accessories
ACNE STUDIOS,Vally Fringed Checked Knitted Scarf,310,accessories
SAINT LAURENT,Surf Logo-Print Wood and Silver-Tone Key Fob,325,accessories
OFF-WHITE,OOO Leather Key Ring,130,accessories
CHOPARD,Classic Racing Engraved Stainless Steel and Carbon Fibre Cufflinks,434,accessories
PRADA EYEWEAR,Square-Frame Acetate Sunglasses,545,accessories
SERAPIAN,Logo-Embossed Coated-Canvas Billfold Wallet,280,accessories
DIME,Logo-Embroidered Washed Cotton-Twill Baseball Cap,40,accessories
DIOR EYEWEAR,CD SU Square-Frame Acetate Sunglasses,600,accessories
PALM ANGELS,Intarsia Cotton-Blend Socks,100,accessories
MIANSAI,Gold Vermeil Citrine Pendant Necklace,175,accessories
CHRISTIAN LOUBOUTIN,Explorafunk Spiked Rubber-Trimmed Full-Grain Leather Backpack,2350,accessories
HESTRA,Primaloft Fleece-Lined Full-Grain Leather Gloves,135,accessories
GUCCI,Cable-Knit Striped Wool Beanie,480,accessories
MONTBLANC,Stainless Steel Cord Bracelet,205,accessories
DIOR EYEWEAR,Diorbay S1U Rectangular-Frame Acetate Mirrored Sunglasses,590,accessories
OFF-WHITE,Bookish Printed Leather Cardholder,260,accessories
MIKIA,"Silver, Cord, Turquoise and Shell Beaded Bracelet",125,accessories
CELINE HOMME,Logo-Print Leather Messenger Bag,1650,accessories
CELINE HOMME,Aviator-Style Gold-Tone Sunglasses,490,accessories
CASABLANCA,Round-Frame Gold- and Silver-Tone Sunglasses,320,accessories
BOTTEGA VENETA,Intrecciato Rubber iPhone 13 Case,350,accessories
ACNE STUDIOS,Logo-Jacquard Cotton-Blend Socks,50,accessories
ANONYMOUS ISM,Scatter Dye Tie-Dyed Ribbed Cotton-Blend Socks,35,accessories
CUTLER AND GROSS,1393 Square-Frame Tortoiseshell Acetate Sunglasses,625,accessories
GUCCI EYEWEAR,Nouvelle D-Frame Acetate Sunglasses,610,accessories
AHLEM,Gaillon Hexagonal-Frame Gold-Tone Optical Lenses,525,accessories
AHLEM,Raspail Round-Frame Tortoiseshell Acetate and Gold-Tone Optical Lenses,525,accessories
AHLEM,Rivoli D-Frame Acetate Sunglasses,515,accessories
MR P.,Ribbed Brushed-Lambswool Beanie,75,accessories
SAINT LAURENT,Leather-Trimmed Logo-Print Canvas Tote Bag,2290,accessories
CUTLER AND GROSS,1391 Square-Frame Acetate Sunglasses,560,accessories
ALEXANDER MCQUEEN,Fringed Printed Modal and Silk-Blend Scarf,330,accessories
ANDERSON'S,3cm Woven Suede Belt,240,accessories
SAINT LAURENT,Cassandre Logo-Appliquéd Croc-Effect Leather Passport Cover,475,accessories
GUCCI,Ophidia Leather-Trimmed Monogrammed Coated-Canvas Belt Bag,1200,accessories
SULKA,Pre-Tied Silk-Twill Bow Tie,220,accessories
ALEXANDER MCQUEEN,Fringed Logo-Embroidered Cashmere Scarf,520,accessories
KAPITAL,"Enamel, Gunmetal-Tone and Elastic Bracelet",45,accessories
GIVENCHY,Logo-Embossed Full-Grain Leather Billfold Wallet,425,accessories
AHLEM,Bellechasse Square-Frame Acetate Optical Lenses,515,accessories
ACNE STUDIOS,Carliy Logo-Appliquéd Denim Baseball Cap,130,accessories
BURBERRY,Striped Palladium-Plated Cufflink,370,accessories
CHOPARD,Classic Racing Engraved Stainless Steel and Carbon Fibre Cufflinks,413,accessories
SAINT LAURENT,4cm Logo-Jacquard Silk Tie,270,accessories
A.P.C.,Logo-Flocked Denim Baseball Cap,105,accessories
JIYONGKIM,Bleached Denim Messenger Bag,455,accessories
CELINE HOMME,Logo-Appliquéd Checked Cotton-Flannel Baseball Cap,590,accessories
DIOR EYEWEAR,Dior90 S1U Rectangular-Frame Silver-Tone Sunglasses,740,accessories
BURBERRY,Palladium-Plated Cufflinks,350,accessories
BALENCIAGA,3.5cm Logo-Embellished Leather Belt,495,accessories
READYMADE,Embroidered Ribbed Cotton-Blend Socks,55,accessories
TIMEX,+ Jacquie Aiche 36mm Gold-Tone Crystal Watch,350,accessories
MULBERRY,Mini Antony Leather-Trimmed Eco Scotchgrain Pouch,490,accessories
RRL,Logo-Appliquéd Herringbone Cotton-Twill Baseball Cap,115,accessories
SAINT LAURENT,Silver-Tone Enamel Necklace,395,accessories
PALM ANGELS,Logo-Jacquard Ribbed Cotton-Blend Socks,95,accessories
SAINT LAURENT,2cm Logo-Embellished Leather Belt,510,accessories
ALEXANDER MCQUEEN,3cm Leather Belt,490,accessories
GARRETT LEIGHT CALIFORNIA OPTICAL,Hercules Round-Frame Tortoiseshell Acetate Optical glasses,355,accessories
MIANSAI,Gold Vermeil Chain Bracelet,115,accessories
CELINE HOMME,Logo-Print Leather Billfold Wallet,530,accessories
MIANSAI,Duo Sterling Silver Onyx Ring,185,accessories
LOEWE,Mushroom Printed Full-Grain Leather Billfold Wallet,490,accessories
TOM WOOD,Kay Reycled Rhodium-Plated Signet Ring,260,accessories
VILEBREQUIN,Boheme Logo-Appliquéd Printed Linen Bucket Hat,105,accessories
BERLUTI,Leather Billfold Wallet,710,accessories
BERLUTI,Scritto 3.5cm Leather Belt,1020,accessories
KAPITAL,Patchwork Embroidered Fleece-Lined Cotton-Canvas Scarf,525,accessories
GUCCI,Leather-Trimmed Monogrammed Cotton-Blend Canvas Baseball Cap,460,accessories
DIOR EYEWEAR,DiorXtrem MU Convertible D-Frame Acetate Sunglasses,620,accessories
PERSOL,Steve McQueen D-Frame Folding Tortoiseshell Acetate Sunglasses,507,accessories
ACNE STUDIOS,Leather-Trimmed Distressed Cotton-Canvas Baseball Cap,170,accessories
FENDI,Aviator-Style Logo-Print Silver-Tone and Acetate Sunglasses,520,accessories
BRAIN DEAD,Equipment Climbing Mesh-Trimmed Colour-Block Ripstop Backpack,200,accessories
POLITE WORLDWIDE,"Protection Sterling Silver, Agate and Enamel Bracelet",600,accessories
DIOR EYEWEAR,DiorBlackSuitO S2U Round-Frame Tortoiseshell Acetate and Gold-Tone Optical Glasses,460,accessories
DENTS,Guildford Mélange Flannel and Leather Gloves,70,accessories
