brand,description,price_usd,type
BELL & ROSS,"BR 03-92 Diver Blue Automatic 42mm Stainless Steel and Rubber Watch, Ref. No. BR0392-D-BU-ST/SRB",3990,watches
BELL & ROSS,"BR 05 Automatic 40mm Stainless Steel Watch, Ref. No. BR05A-BR-ST/SST",5100,watches
GLOBE-TROTTER,Centenary Leather-Trimmed Vulcanised Fibreboard Three-Piece Watch Box,1445,watches
ORIS,"Divers Sixty-Five Automatic 38mm Bronze and Recycled-Perlon Watch, Ref. No. 01 733 7771 3158-07 3 19 04BR",2650,watches
BELL & ROSS,"BR 03-92 Grey Lum Automatic 42mm Stainless Steel and Leather Watch, Ref. No. BR0392-GC3-ST/SCA",3600,watches
LA CALIFORNIENNE,Aquatica Striped Leather Watch Strap,400,watches
SCATOLA DEL TEMPO,Rotor One RC Sport Leather Watch Winder,615,watches
BELL & ROSS,"BR 05 Automatic GMT 41mm Stainless Steel and Rubber Watch, Ref. No. BR05G-SI-ST/SRB BU23NOV",5000,watches
IWC SCHAFFHAUSEN,"Big Pilot's Automatic 43mm Stainless Steel and Leather Watch, Ref. No. IW329303",8950,watches
ORIS,"Aquis Date Automatic 41.5mm Stainless Steel Watch, Ref. No. 01 733 7766 4157-07 8 22 05PEB",2460,watches
WOLF,Roadster Pebble-Grain Vegan Leather Double Watch Winder,1379,watches
WOLF,Club Full-Grain Vegan Leather Double Watch Winder,759,watches
CHOPARD,"Alpine Eagle XL Chrono Automatic 44mm Lucent Steel Watch, Ref. No. 298609-3001",21000,watches
ORIS,"Big Crown ProPilot Big Day Date Automatic 44mm Stainless Steel and Leather Watch, Ref. No. 01 752 7760 4065-07 5 22 07LC",2270,watches
CHARLES SIMON,Mackenzie Full-Grain Leather Twelve-Piece Travel Watch Case,7490,watches
BUCCELLATI,"Ornatino Automatic 42mm 18-Karat White Gold and Croc-Effect Leather Watch, Ref. No. WAUMGE014262",32500,watches
RAPPORT LONDON,Quantum Duo Leather-Wrapped Cedar and Glass Watch Winder,1395,watches
BELL & ROSS,"BR V2-92 Orange Limited Edition Automatic 41mm Stainless Steel Watch, Ref. No. BRV292-O-ST/SST",3800,watches
L’ÉPÉE 1839,+ Fiona Krüger Vanitas Limited Edition Hand-Wound Palladium-Coated and PVD Wall Clock,40635,watches
LA CALIFORNIENNE,Seabright Striped Leather Watch Strap,400,watches
GERALD CHARLES,"GC Sport Automatic 39mm Titanium and Rubber Watch, Ref. No. GC2.0-TX-TN-01",18690,watches
WOLF,Axis Vegan Leather Two-Piece Watch Winder,1379,watches
WOLF,Cub Full-Grain Vegan Leather Single Watch Winder,379,watches
IWC SCHAFFHAUSEN,"Pilot's Automatic Chronograph 41mm Stainless Steel and Leather Watch, Ref. No. IW388103",7600,watches
RAPPORT LONDON,Perpetua III Lacquered Walnut Watch Winder,1650,watches
BELL & ROSS,"BR 05 Automatic GMT 41mm Stainless Steel Watch, Ref. No. BR05G-BL-ST/SST",5500,watches
ORIS,"Big Crown ProPilot Big Day Date Automatic 44mm Stainless Steel Watch, Ref. No. 01 752 7760 4063-07 8 22 08P",2525,watches
WOLF,Club Full-Grain Vegan Leather Single Watch Winder,379,watches
WOLF,Axis Triple Vegan Leather Watch Winder,2045,watches
WOLF,Pebble-Grain Vegan Leather Triple Watch Winder,2239,watches
WOLF,Memento Mori Embroidered Vegan Leather Double Watch Winder,779,watches
RAPPORT LONDON,Quantum Duo Metallic Leather-Wrapped Cedar and Glass Watch Winder,1395,watches
LA CALIFORNIENNE,Roxy Striped Leather Watch Strap,400,watches
RAPPORT LONDON,Formula Quad Carbon Fibre Lacquered Cedar and Glass Watch Winder,1795,watches
SCATOLA DEL TEMPO,Rotor One Sport Leather Watch Winder,615,watches
L’ÉPÉE 1839,"+ ECAL + Juliette Lefèvre Time Flies Limited Edition Hand-Wound Time Flies Bronze Table Clock, Ref. No 74.6006/600",37275,watches
LA CALIFORNIENNE,Ivy Striped Leather Watch Strap,400,watches
SWISSKUBIK,Masterbox Anodised Aluminium Watch Winder,795,watches
HORUS WATCH STRAPS,24mm Rubber Watch Strap,155,watches
LA CALIFORNIENNE,Liberty Striped Leather Watch Strap,400,watches
BELL & ROSS,"BR 03-92 Diver Automatic 42mm Stainless Steel and Rubber Watch, Ref. No. BR0392-D-WH-ST/SRB",3990,watches
L’ÉPÉE 1839,+ Fiona Krüger Vanitas Limited Edition Hand-Wound Palladium-Coated Wall Clock,40635,watches
WOLF,Cub Pebble-Grain Vegan Leather Watch Winder,379,watches
RAPPORT LONDON,Marlow Snake-Effect Leather Watch Roll,250,watches
RAPPORT LONDON,Marlow Snake-Effect Leather Three-Watch Roll,350,watches
RAPPORT LONDON,Perpetua III Lacquered Walnut Watch Winder,645,watches
RAPPORT LONDON,Lacquered Ebony and Glass Watch Winder,1095,watches
RAPPORT LONDON,Perpetua III Lacquered Ebony Watch Winder,595,watches
BELL & ROSS,"BR 05 Automatic Chronograph 42mm Stainless Steel Watch, Ref. No. BR05C-BU-ST/SST",6700,watches
BELL & ROSS,"BR 05 Automatic GMT 41mm Stainless Steel and Rubber Watch, Ref. No. BR05G-BL-ST/SRB",5000,watches
HORUS WATCH STRAPS,24mm Camouflage-Print Rubber Watch Strap,175,watches
BELL & ROSS,"BR 05 Automatic Chronograph 42mm Stainless Steel Watch, Ref. No. BR05C-BL-ST/SST",6700,watches
BRUNELLO CUCINELLI,Logo-Embroidered Shell-Trimmed Padded Wool Hooded Ski Jacket,7095,sport
BRUNELLO CUCINELLI,Logo-Embroidered Fleece Half-Zip Ski Base Layer,2450,sport
MR P.,+ Diemme Roccia Vet Sport Leather-Trimmed Mesh and Rubber Hiking Boots,525,sport
SATISFY,Logo-Print GhostFleece™ Polartec®Power Grid™ Half‑Zip Sweatshirt,280,sport
MONCLER GRENOBLE,Logo-Appliquéd Ribbed Wool Beanie,260,sport
SATISFY,"Layered Rippy™, Justice™ and Coldblack® Shorts",240,sport
MONCLER GRENOBLE,Montgirod Logo-Print GORE-TEX® Hooded Down Ski Jacket,2725,sport
MONCLER GRENOBLE,Straight-Leg Colour-Block Shell Ski Salopettes,1585,sport
SALOMON,"Quest 3 Advanced GORE-TEX™ Mesh, Leather and Suede Hiking Boots",280,sport
BRUNELLO CUCINELLI,Logo-Print Stretch-Silk Ski Base Layer,930,sport
66 NORTH,Logo-Embroidered Shell Backpack,145,sport
LULULEMON,License to Train Slim-Fit Tapered Stretch Recycled-Shell Track Pants,130,sport
66 NORTH,Dyngja Logo-Appliquéd Quilted Printed Recycled-Shell Down Gilet,425,sport
MONCLER GRENOBLE,Arpasson Logo-Appliquéd Padded Recycled-Ripstop Down Gilet,1170,sport
GOLDWIN,Tapered Stretch-CORDURA® Ripstop Cargo Trousers,280,sport
KJUS,Formula Quilted Shell-Trimmed Tech-Jersey Jacket,300,sport
GOLDWIN,Easy Straight-Leg Nylon-Twill Trousers,260,sport
APL ATHLETIC PROPULSION LABS,Streamline Rubber-Trimmed Ripstop Sneakers,320,sport
66 NORTH,Dyngja Quilted Printed Recycled-Shell Hooded Down Jacket,530,sport
METALWOOD,+ Throwing Fits Logo-Print Tech-Jersey Golf Top,190,sport
BRUNELLO CUCINELLI,Straight-Leg Logo-Embroidered Shell-Trimmed Cotton-Corduroy Ski Pants,2995,sport
MONCLER GRENOBLE,Day-Namic Renardeau Panelled 2L GORE-TEX INFINIUM™and Corduroy Jacket,1720,sport
CANADA GOOSE,Logo-Appliquéd Wool Beanie,195,sport
66 NORTH,Dyngja Logo-Embroidered Quilted Recycled-Shell Down Gilet,395,sport
FUSALP,Mario III Logo-Appliquéd Stretch-Jersey Base Layer,170,sport
AND WANDER,+ Salomon XA PRO 3D Rubber-Trimmed GORE-TEX® Mesh Trail Running Sneakers,480,sport
GOLDWIN,WF Light Waffle-Knit Delta Solotex T-Shirt,130,sport
SNOW PEAK,Takibi Straight-Leg Ripstop Trousers,330,sport
GOLDWIN,Quilted Pertex® Quantum Hooded Down Jacket,630,sport
MR P.,+ Diemme Roccia Basso Rubber-Trimmed Suede Hiking Boots,470,sport
CANADA GOOSE,Faber Logo-Appliquéd Shell Hooded Jacket,575,sport
MONCLER GRENOBLE,Logo-Appliquéd Leather-Trimmed Ski Gloves,950,sport
MONCLER GRENOBLE,Straight-Leg GORE-TEX® Ski Pants,1515,sport
AZTECH MOUNTAIN,Super Nuke Two-Tone DYNTEX® Hooded Down Ski Jacket,1850,sport
DISTRICT VISION,Zanzie Tapered Logo-Print Recycled-Shell Track Pants,285,sport
APL ATHLETIC PROPULSION LABS,TechLoom Phantom Running Sneakers,185,sport
CANADA GOOSE,Lawrence Slim-Fit Logo-Appliquéd Quilted Enduraluxe® Down Gilet,750,sport
MONCLER GRENOBLE,Leather-Panelled Ski Gloves,950,sport
GOLDWIN,G-Solid Straight-Leg Ski Trousers,520,sport
CANADA GOOSE,Macmillan Logo-Appliquéd Quilted Arctic Tech® Hooded Down Parka,1075,sport
MONCLER GRENOBLE,Straight-Leg GORE-TEX® Ski Pants,1160,sport
CANADA GOOSE,Black Label Garson Quilted Shell Down Gilet,595,sport
MONCLER GRENOBLE,Logo-Appliquéd Leather-Trimmed Ski Mittens,815,sport
CANADA GOOSE,Black Label Huron Tapered Logo-Appliquéd Cotton-Jersey Sweatpants,275,sport
MONCLER GRENOBLE,Slim-Fit Polartec® Power Grid™ Half-Zip Base Layer,580,sport
ZEGNA,Straight-Leg Padded Cashmere Ski Pants,4450,sport
GUCCI EYEWEAR,Webbing-Trimmed Acetate Mirrored Ski Goggles,1100,sport
COTOPAXI,Solazo Quilted Twill and Ripstop Hooded Down Jacket,300,sport
CANADA GOOSE,Northern Liner Quilted Arctic Tech® Shell Down Gloves,195,sport
MONCLER GRENOBLE,Lagorai Quilted Hooded Down Ski Jacket,2555,sport
CANADA GOOSE,Chateau Appliquéd Arctic Tech® Hooded Down Parka,1395,sport
MONCLER GRENOBLE,Carryover Montgetech Quilted Hooded Down Ski Jacket,2545,sport
CANADA GOOSE,Macmillan Logo-Appliquéd Quilted Shell Hooded Down Parka,1075,sport
CANADA GOOSE,Chilliwack Arctic Tech® Hooded Down Jacket,1195,sport
MONCLER GRENOBLE,Arcesaz Logo-Appliquéd Quilted Hooded Down Ski Jacket,2270,sport
MONCLER GRENOBLE,Camurac Logo-Appliquéd Quilted Hooded Down Ski Jacket,2200,sport
ZEGNA,Straight-Leg Padded Ski Pants,4450,sport
MONCLER GRENOBLE,Padded Cotton-Blend Corduroy Down Jacket,1445,sport
BOGNER,Felias Two-Tone Quilted Hooded Down Ski Jacket,1800,sport
MONCLER GRENOBLE,Knitted and Quilted Shell Down Ski Jacket,1205,sport
CANADA GOOSE,HyBridge® Stretch Jersey-Panelled CORDURA®  Down Jacket,895,sport
BRUNELLO CUCINELLI,Padded Corduroy-Trimmed Wool-Flannel Ski Jacket,7595,sport
MONCLER GRENOBLE,Lagorai Quilted Shell Hooded Down Jacket,2555,sport
BOGNER,Logo-Print Colour-Block Padded Hooded Down Ski Jacket,2200,sport
66 NORTH,Dyngja Quilted Recycled-Shell Hooded Down Jacket,590,sport
ZEGNA,Quilted Shell Hooded Down Ski Jacket,2450,sport
MONCLER GRENOBLE,Cristaux Logo-Appliquéd Quilted Shell Down Hooded Ski Jacket,2135,sport
BOGNER,Henrik Quilted Padded Hooded Ski Jacket,1900,sport
CANADA GOOSE,Lodge Quilted Ripstop Down Jacket,750,sport
BOGNER,Tim Straight-Leg Belted Logo-Debossed Padded Ski Trousers,890,sport
MONCLER GRENOBLE,Jersey-Trimmed Fleece Half-Zip Ski Base Layer,700,sport
CANADA GOOSE,Crofton Slim-Fit Logo-Appliquéd Quilted Nylon-Ripstop Hooded Down Jacket,950,sport
MONCLER GRENOBLE,Logo-Appliquéd Wool-Blend Fleece Balaclava,525,sport
MR P.,+ Diemme Roccia Vet Full-Grain Leather Hiking Boots,525,sport
MONCLER GRENOBLE,Quilted Panelled Jersey Down Ski Jacket,1185,sport
CANADA GOOSE,Logo-Appliquéd Ribbed Wool Beanie,195,sport
CANADA GOOSE,Chateau Appliquéd ARCTIC TECH® Shell Hooded Down Parka,1395,sport
NIKE GOLF,Air Jordan 1 Low G Croc-Effect Trimmed Leather Golf Sneakers,150,sport
GOLDWIN,Logo-Embroidered Padded 2L PERTEX® SHIELD Hooded Ski Jacket,1000,sport
MONCLER GRENOBLE,Shell-Trimmed Fleece Ski Jacket,700,sport
BRUNELLO CUCINELLI,Straight-Leg Logo-Print Cotton-Corduroy Ski Pants,3295,sport
CANADA GOOSE,HyBridge Quilted Shell Shirt Jacket,650,sport
MONCLER GRENOBLE,Brizon Colour-Block Ski Jacket,2065,sport
MONCLER GRENOBLE,Moriond Logo-Print GORE-TEX® Hooded Jacket,2135,sport
PAS NORMAL STUDIOS,Mechanism Pro Rain Logo-Print Cycling Jersey,295,sport
BOGNER,Mica Colour-Block Logo-Print Stretch-Jersey Half-Zip Base Layer,290,sport
MONCLER GRENOBLE,Shell-Trimmed Wool Rollneck Sweater,870,sport
CANADA GOOSE,Mersey Logo-Appliquéd Recycled Wool-Blend Fleece Gilet,525,sport
MONCLER GRENOBLE,Shell-Trimmed Logo-Print Fleece Ski Jacket,745,sport
GOLDWIN,Wide-Leg 2L GORE-TEX® Ski Trousers,770,sport
LOEWE,+ On Cloudtilt Stretch-Knit Sneakers,490,sport
GOLDWIN,3L GORE-TEX® Hooded Ski Jacket,1000,sport
CANADA GOOSE,Macmillan Logo-Appliquéd Quilted Shell Hooded Down Parka,1125,sport
BOGNER,Tino-D Quilted Shell Down Hooded Jacket,1900,sport
BOGNER,Kolya Padded Quilted Shell-Trimmed Stretch-Shell Jacket,490,sport
PAS NORMAL STUDIOS,Mechanism Logo-Print Pertex® Shield Air Cycling Jacket,295,sport
HOUDINI,RollerCoaster Recycled Hooded Ski Jacket,700,sport
METALWOOD,+ Throwing Fits 3cm Cow-Print Faux Calf Hair Golf Belt,140,sport
GOLDWIN,Logo-Embroiderd 2L GORE-TEX® Ski Jacket,890,sport
GOLDWIN,Logo-Embroidered Two-Tone Padded Hooded Ski Jacket,800,sport
BRUNELLO CUCINELLI,Logo-Embroidered Padded Cotton-Corduroy Hooded Ski Jacket,5995,sport
FUSALP,Abelban Quilted Colour-Block Hooded Ski Jacket,1390,sport
MONCLER GRENOBLE,Raffort Quilted Glossed-Shell Down Jacket,1720,sport
METALWOOD,+ Throwing Fits 3cm Snake-Effect Leather Golf Belt,110,sport
BOGNER,Tim2-T Straight-Leg Belted Logo-Embossed Ski Pants,590,sport
ZEGNA,Leather-Trimmed Quilted Hooded Cotton-Blend Corduroy Down Jacket,5450,sport
NIKE RUNNING,React Infinity Run 4 Rubber-Trimmed Flyknit Sneakers,160,sport
GOLDWIN,Pertex® Quantum Air Hooded Ski Jacket,410,sport
MONCLER GRENOBLE,Wool-Blend Jacquard Sweater,1515,sport
HOUDINI,Heyday Recycled Hooded Ski Jacket,800,sport
MONCLER GRENOBLE,Printed GORE-TEX® Hooded Jacket,1720,sport
GOLDWIN,Padded Pertex® Quantum Hooded Jacket,450,sport
MONCLER GRENOBLE,Granges Colour-Block GORE-TEX™ WINDSTOPPER Hooded Jacket,1650,sport
GOLDWIN,Ripstop-Trimmed Polartec® High Loft™ Fleece Jacket,430,sport
66 NORTH,Snaefell Polartec® Neoshell® Hooded Jacket,525,sport
BOGNER,Tim2-T Straight-Leg Belted Logo-Embossed Ski Pants,890,sport
SATISFY,Straight-Leg Logo-Appliqued TechSilk™ and Justice™ CoffeeThermal™ Shorts,220,sport
BOGNER,Curt Slim-Fit Belted Logo-Print Ski Pants,790,sport
CANADA GOOSE,Crofton Slim-Fit Logo-Appliquéd Quilted Nylon-Ripstop Down Gilet,595,sport
GOLDWIN,Wide-Leg 3L GORE-TEX® Ski Trousers,830,sport
BOGNER,Harry Slim-Fit Tech-Fleece Half-Zip Base Layer,220,sport
MONCLER GRENOBLE,Jantzen Logo-Appliquéd Stretch-Cotton Corduroy Down Gilet,1310,sport
66 NORTH,Tindur Quilted GORE-TEX® Down Jacket,1175,sport
CANADA GOOSE,"Glacier Trial Jersey, Suede and Leather-Trimmed Ripstop High-Top Hiking Sneakers",550,sport
GOLDWIN,Polartec® Fleece Half-Zip Ski Base Layer,240,sport
HOUDINI,Heyday Straight-Leg Recycled Ski Pants,650,sport
BOGNER,Neal Recycled Nylon-Trimmed Shell and Fleece Jacket,550,sport
FUSALP,Aspon II Paneled Stretch-Jersey and Quilted Shell Jacket,380,sport
NIKE RUNNING,ZoomX Invincible 3 Flyknit Running Sneakers,228,sport
SALOMON,+ 11 by Boris Bidjan Saberi A.B.1. Mesh and Rubber Sneakers,315,sport
SALOMON,ACS Pro Rubber-Trimmed Mesh Sneakers,230,sport
COLMAR,Logo-Print Twill Hooded Down Ski Jacket,850,sport
PAS NORMAL STUDIOS,Mechanism Logo-Print Cycling Jersey,220,sport
MONCLER GRENOBLE,Doron Padded Ripstop Jacket,1195,sport
FUSALP,Flash II Ski Salopettes,680,sport
NIKE RUNNING,ZoomX Vaporfly 3 Flyknit Running Sneakers,260,sport
GOLDWIN,Logo-Embroidered Pertex® Shield Air Ripstop Jacket,470,sport
FUSALP,Timothy Logo-Print Brushed Neoprene Ski Base Layer,330,sport
66 NORTH,Hornstrandir GORE-TEX® Pro 3L Hooded Ski Jacket,750,sport
BOGNER,Conrad Logo-Embroidered Ribbed-Knit Ski Beanie,140,sport
BOGNER,Xilas Logo-Appliquéd Stretch-Jersey Zip-Up Mid-Layer,450,sport
GOLDWIN,Logo-Embroidered Padded 2L GORE-TEX® Gilet,490,sport
GOLDWIN,2L GORE-TEX® Hooded Down Jacket,1100,sport
FUSALP,Ceillac Logo-Appliquéd Ribbed EcoVero™-Blend Rollneck Ski Base Layer,250,sport
COTOPAXI,Solazo Logo-Print Quilted Ripstop Hooded Down Jacket,240,sport
GOLDWIN,Straight-Leg Belted CORDURA® Trousers,260,sport
COTOPAXI,Fuego Colour-Block Quilted Ripstop Down Hooded Jacket,295,sport
ZEGNA,Logo-Print High Performance™ Wool T-Shirt,1150,sport
BOGNER,Paco Slim-Fit Printed Striped Stretch-Jersey Base Layer,320,sport
NIKE TRAINING,Nike Air Zoom TR 1 Rubber-Trimmed Suede Sneakers,164,sport
MONCLER EYEWEAR,Terrabeam S2 Ski Goggles,465,sport
BOGNER,Dorian Padded Quilted Ripstop Hooded Ski Jacket,990,sport
FUSALP,Power Logo-Appliquéd Padded Shell Hooded Jacket,1350,sport
APL ATHLETIC PROPULSION LABS,Concept X TechLoom Basketball Sneakers,400,sport
MONCLER EYEWEAR,Terrabeam S1 Photochromatic Ski Goggles,465,sport
NIKE RUNNING,React Infinity Run 4 Flyknit Sneakers,160,sport
66 NORTH,Tindur Logo-Appliquéd Jersey-Panelled Fleece Jacket,260,sport
GOLDWIN,Straight-Leg Belted Shell Trousers,260,sport
MONCLER GRENOBLE,Logo-Appliquéd Shell Belt Bag,735,sport
NIKE TENNIS,NikeCourt Zoom Vapor Cage 4 Rafa Rubber-Trimmed Mesh Sneakers,150,sport
SNOW PEAK,2L Octa Tapered Shell Trousers,230,sport
PETER MILLAR,Perth Tech-Jersey Half-Zip Golf Top,135,sport
APL ATHLETIC PROPULSION LABS,Superfuture TechLoom and TPU High-Top Running Sneakers,300,sport
SALOMON,ACS Pro Mesh and Rubber Sneakers,220,sport
NIKE RUNNING,React Phantom Run 2 Rubber-Trimmed Flyknit and Flyknit Loft Running Sneakers,140,sport
NIKE TRAINING,Metcon 9 Rubber-Trimmed Mesh Sneakers,150,sport
PETER MILLAR,All Course Quilted Shell Golf Gilet,200,sport
AND WANDER,Printed Pertex® Hooded Jacket,1175,sport
GOLDWIN,All Directions Warm Hike Logo-Embroidered Octa Shirt,320,sport
PETER MILLAR,Weld Elite Hybrid Quilted Shell and Stretch-Jersey Half-Zip Golf Jacket,210,sport
BOGNER,+ 007 Jarry Printed Fleece-Back Stretch-Jersey Half-Zip Base Layer,320,sport
66 NORTH,Laugavegur Slim-Fit Belted Recycled-Shell Cargo Trousers,225,sport
METALWOOD,+ Throwing Fits Wide-Leg Snake-Print Shell Trousers,170,sport
APL ATHLETIC PROPULSION LABS,Defender TechLoom and TPU High-Top Running Sneakers,345,sport
NIKE RUNNING,Free Run Next Nature Flyknit Running Sneakers,100,sport
MONCLER GRENOBLE,Mazod Printed Ripstop Down Ski Jacket,2210,sport
NIKE TENNIS,NikeCourt Air Zoom Vapor Pro 2 Rubber-Trimmed Mesh Tennis Sneakers,130,sport
GOLDWIN,Slim-Fit Straight-Leg Logo-Print Ripstop Shorts,170,sport
COTOPAXI,Fuego Quilted Ripstop Hooded Down Jacket,295,sport
NIKE RUNNING,React Pegasus Trail 4 GORE-TEX® Running Sneakers,160,sport
GOLDWIN,Ripstop Hooded Jacket,210,sport
DISTRICT VISION,Shell Hooded Jacket,495,sport
PAS NORMAL STUDIOS,Mechanism Thermal Logo-Print Cycling Jersey,295,sport
CANADA GOOSE,Mersey Logo-Appliquéd Wool-Blend Fleece Gilet,525,sport
NIKE RUNNING,Aeroswift Ribbed Dri-FIT ADV Tights,125,sport
66 NORTH,Hrannar Logo-Appliquéd Waffle-Knit Polartec® Alpha® Half-Zip Sweatshirt,165,sport
FUSALP,Alvin Logo-Intarsia Wool Half-Zip Sweater,440,sport
SALOMON,Odyssey ELMT Low Suede and Mesh Sneakers,220,sport
NIKE GOLF,Tour Slim-Fit Dri-FIT ADV Jacquard Half-Zip Golf Top,120,sport
AND WANDER,Padded Fleece and Pertex Hooded Jacket,590,sport
MONCLER GRENOBLE,Logo-Appliquéd Tech-Canvas and Mesh Backpack,1320,sport
AND WANDER,Logo-Embroidered Polartec® Fleece Jacket,630,sport
HOKA ONE ONE,Mafate Three2 Rubber-Trimmed Mesh Running Sneakers,185,sport
MONCLER GRENOBLE,Logo-Appliquéd Stretch-Fleece and Jersey Beanie,290,sport
MONCLER GRENOBLE,Shell-Trimmed Cotton-Jersey Hoodie,760,sport
PETER MILLAR,Fuse Elite Quilted Colour-Block Shell and Stretch-Jersey Golf Gilet,200,sport
ZEGNA,High Performance™ Wool Half-Zip Base Layer,1150,sport
MONCLER EYEWEAR,Terrabeam S3 Ski Goggles,390,sport
NIKE RUNNING,Element Logo-Print Dri-FIT T-Shirt,60,sport
SALOMON,ACS Pro Mesh and Rubber Sneakers,230,sport
HOUDINI,Rollercoaster Straight-Leg Recycled Ski Salopettes,650,sport
AND WANDER,Alpha AIR Logo-Print Padded Pertex-Ripstop Hooded Jacket,590,sport
MONCLER GRENOBLE,Monthey Logo-Print Quilted Ripstop Hooded Down Ski Jacket,1980,sport
MONCLER EYEWEAR,Terrabeam S3 Ski Goggles,465,sport
KJUS,Formula Padded Hooded Ski Jacket,1100,sport
BOGNER,+ 007 Nori Straight-Leg Belted Logo-Print Ski Pants,990,sport
SNOW PEAK,Quilted Shell Down Jacket,450,sport
COLMAR,Textured-Shell Hooded Down Jacket,350,sport
MONCLER GRENOBLE,Tapered Belted Logo-Print Shell Trousers,775,sport
COLMAR,Slim-Fit Logo-Print Stretch-Jersey Half-Zip Base Layer,175,sport
NIKE RUNNING,2-in-1 Stride Straight-Leg Dri-FIT Ripstop and Stretch-Jersey Shorts,65,sport
NIKE RUNNING,ZoomX Invincible 3 Flyknit Running Sneakers,180,sport
MONCLER GRENOBLE,Panelled Quilted Shell and Fleece Hooded Down Ski Jacket,1110,sport
NIKE RUNNING,React Infinity Run 4 Rubber-Trimmed Flyknit Sneakers,202,sport
COTOPAXI,Capa Colour-Block Quilted Padded Recycled-Ripstop PrimaLoft® Jacket,250,sport
FUSALP,Nyx Logo-Appliquéd Ribbed Wool Beanie,170,sport
PAS NORMAL STUDIOS,Mechanism Logo-Print Cycling Jersey,295,sport
NIKE TRAINING,Nike Air Zoom TR 1 Rubber-Trimmed Suede Sneakers,130,sport
66 NORTH,Vatnajökull Quilted Padded Recycled-Shell Jacket,360,sport
NIKE RUNNING,Infinity Run 4 ReactX Flyknit Running Sneakers,160,sport
MONCLER GRENOBLE,Shell-Trimmed Fleece Jacket,565,sport
ON,Energy Eyelet-Embellished Logo-Print Recycled-Jersey T-Shirt,90,sport
SNOW PEAK,Thermal Boa Polartec® Fleece Jacket,240,sport
NIKE TENNIS,NikeCourt Rafa Perforated Dri-FIT Tennis Jacket,105,sport
HOUDINI,Dunfri Packable Padded Recycled-Ripstop Hooded Ski Jacket,300,sport
NIKE GOLF,Tour Dri-FIT Jacquard Golf Polo Shirt,80,sport
SALOMON,XT-Slate Advanced Rubber and Mesh Sneakers,230,sport
G/FORE,Gallivanter Pebble-Grain Leather Golf Shoes,195,sport
NIKE TRAINING,Pro Flex Rep Straight-Leg Mesh-Trimmed Dri-FIT Shorts,80,sport
MAAP,Halftone Pro Base Panelled Logo-Print Stretch Recycled Mesh Cycling Jersey,195,sport
NIKE TRAINING,Yoga Textured Dri-FIT Top,85,sport
NIKE TRAINING,Zoom Metcon Turbo 2 Rubber-Trimmed Mesh and Ripstop Sneakers,160,sport
NIKE RUNNING,Infinity Run 4 ReactX GORE-TEX® Running Sneakers,180,sport
MONCLER GRENOBLE,Day-Namic Logo-Appliquéd Fleece and Stretch-Knit Gloves,300,sport
APL ATHLETIC PROPULSION LABS,Big Logo TechLoom and Mesh Slides,120,sport
SALOMON,XT-6 Rubber-Trimmed Mesh Sneakers,200,sport
MONCLER GRENOBLE,Slim-Fit Quilted Ripstop and Jersey Down Jacket,1095,sport
66 NORTH,Esja Logo-Appliquéd Fleece Half-Zip Sweatshirt,175,sport
66 NORTH,Snaefell Straight-Leg Polartec® NeoShell® Trousers,395,sport
SALOMON,"Odyssey Element Advanced Canvas, Mesh and Suede Hiking Shoes",280,sport
CANADA GOOSE,Huron Logo-Appliquéd Loopback Cotton-Jersey Sweatshirt,375,sport
CANADA GOOSE,Journey Rubber and Nubuck-Trimmed Full-Grain Leather Hiking Boots,750,sport
SNOW PEAK,2L Ripstop Hooded Down Jacket,650,sport
NIKE RUNNING,Air Zoom Pegasus 40 Rubber-Trimmed Mesh Running Sneakers,130,sport
MONCLER GRENOBLE,Peyrus Colour-Block Padded Ripstop Hooded Jacket,1750,sport
KJUS,Formula Straight-Leg Padded Ski Pants,600,sport
BLACK CROWS,Freebird Recycled-3L Xpore® Hooded Ski Jacket,730,sport
RAPHA,Classic Recycled Cycling Bib Shorts,260,sport
NIKE GOLF,Air Zoom Infinity Tour Next% Rubber and Leather-Trimmed Mesh Golf Sneakers,170,sport
NIKE GOLF,Tour Striped Dri-FIT Golf Polo Shirt,80,sport
ZEGNA,Wool-Panelled Ripstop Hooded Jacket,2650,sport
HOUDINI,Desoli Solid Merino™ Base Layer,115,sport
PETER MILLAR,Forge Tech-Jersey Jacquard Half-Zip Golf Top,145,sport
APL ATHLETIC PROPULSION LABS,TechLoom Wave Mesh Running Sneakers,245,sport
NIKE RUNNING,AeroSwift Tapered Dri-FIT ADV Track Pants,125,sport
SALOMON,Odyssey ELMT Mid Suede and Mesh-Trimmed GORE-TEX® Sneakers,250,sport
APL ATHLETIC PROPULSION LABS,Tracer TechLoom and Scuba Running Sneakers,250,sport
NIKE GOLF,Tour Dri-FIT ADV Jacquard Golf Polo Shirt,105,sport
HOUDINI,Power Up Houdi Polartec® Power Stretch® Pro™ Ski Base Layer,230,sport
NORDA,001 Mesh Running Sneakers,295,sport
AZTECH MOUNTAIN,Nuke Suit Quilted Hooded Down Ski Jacket,1650,sport
COLMAR,Logo-Print Shell-Trimmed Fleece Jacket,275,sport
MONCLER GRENOBLE,Logo-Appliquéd Jacquard Wool-Blend Beanie,250,sport
PAS NORMAL STUDIOS,Solitude Logo-Print Polartec® DELTA™ Mesh Cycling Jersey,220,sport
HOUDINI,Power Houdi Slim-Fit Polartec® Power Stretch® Pro™ Ski Base Layer,240,sport
COLMAR,Reversible Padded Ripstop Hooded Ski Jacket,550,sport
AND WANDER,Ecopack Logo-Print Recycled Ripstop Backpack,805,sport
PETER MILLAR,Fuse Elite Quilted Shell and Stretch-Jersey Golf Gilet,200,sport
SNOW PEAK,2L Octa Shell Jacket,240,sport
NIKE TENNIS,NikeCourt Air Zoom Vapor Pro 2 Rubber-Trimmed Mesh Tennis Sneakers,120,sport
HOUDINI,Pace Slim-Fit Recycled Ski Pants,320,sport
NIKE TENNIS,Court Heritage Logo-Appliquéd Tech-Jersey Tennis Jacket,90,sport
NIKE RUNNING,Trail Solar Chase Dri-FIT Mesh T-Shirt,65,sport
NIKE TENNIS,NikeCourt Advantage Straight-Leg Dri-FIT Tennis Shorts,65,sport
NIKE RUNNING,Element Logo-Print Dri-FIT Half-Zip Top,70,sport
COTOPAXI,Fuego Packable Striped Quilted Ripstop Down Gilet,185,sport
NIKE TENNIS,NikeCourt Advantage Straight-Leg Dri-FIT Shorts,65,sport
SUNSPEL,Merino Wool Long Johns,250,sport
FUSALP,Mauro Quilted Shell Gilet,450,sport
NIKE RUNNING,Slim-Fit Dri-FIT ADV TechKnit T-Shirt,90,sport
DISTRICT VISION,Logo-Appliquéd Organic Cotton and Recycled Shell-Blend Hooded Jacket,550,sport
NIKE RUNNING,Stride Straight-Leg Mesh-Panelled Dri-FIT Ripstop Shorts,55,sport
AZTECH MOUNTAIN,Nuke Suit Quilted Hooded Down Ski Jacket,1485,sport
BLACK CROWS,Ora II Quilted Pertex® Quantum Hooded Down Ski Jacket,480,sport
NIKE TRAINING,A.P.S. Tapered Therma-FIT ADV Sweatpants,160,sport
NIKE TRAINING,APS Straight-Leg Logo-Embroidered Dri-FIT ADV Shorts,110,sport
CANADA GOOSE,Crofton Suede-Trimmed Quilted Ripstop Boots,525,sport
SALOMON,XT-6 GTX GORE-TEX™ Running Sneakers,220,sport
NIKE GOLF,Player Dri-FIT Half-Zip Golf Top,105,sport
NIKE TENNIS,Air Zoom Vapor 11 Rubber-Trimmed Mesh Tennis Sneakers,170,sport
HOKA ONE ONE,Kaha GORE-TEX® and Leather Boots,260,sport
COTOPAXI,Capa Quilted Padded Recycled-Ripstop PrimaLoft® Gilet,175,sport
SALOMON,"Jungle Ultra Low Advanced Leather, Suede and Mesh Sneakers",180,sport
MAAP,Blurred Out Pro Hex 2.0 Logo-Print Recycled Cycling Jersey,195,sport
MONCLER GRENOBLE,Tapered Logo-Print GORE-TEX® Trousers,775,sport
HOUDINI,Desoli Merino Wool Base Layer,115,sport
NIKE RUNNING,Flex Stride 2-in-1 Straight-Leg Mesh-Trimmed Dri-FIT Shorts,55,sport
NIKE GOLF,Air Zoom Victory Tour 3 Suede and Nubuck-Trimmed Full-Grain Leather Golf Sneakers,190,sport
BRUNELLO CUCINELLI,Straight-Leg Padded Tech-Shell Ski Trousers,2995,sport
NIKE GOLF,Tour Dri-FIT ADV Half-Zip Golf Top,120,sport
PETER MILLAR,Crown Quilted Shell Golf Jacket,225,sport
NIKE TENNIS,NikeCourt Air Zoom NXT Rubber-Trimmed Mesh Tennis Sneakers,140,sport
NIKE TRAINING,Wellness Club Logo-Print Dri-FIT T-Shirt,60,sport
NIKE TRAINING,Unlimited Logo-Embroidered Shell Hooded Jacket,110,sport
CANADA GOOSE,HyBridge Slim-Fit Merino Wool and Quilted Nylon Down Gilet,525,sport
