brand,description,price_usd,type
CANADA GOOSE,Arctic Logo-Appliquéd Twill Baseball Cap,225,accessories
GUCCI,Monogrammed Full-Grain Leather Travel Wallet,1690,accessories
LOEWE EYEWEAR,Inflated Round-Frame Acetate Sunglasses,360,accessories
ACNE STUDIOS,Canada Skinny Fringed Wool Scarf,170,accessories
CELINE HOMME,Silver-Tone Chain Necklace,1350,accessories
CHOPARD,Braided Leather and Silver-Tone Keyring,348,accessories
PALM ANGELS,Logo-Embroidered Cotton-Twill Baseball Cap,225,accessories
SMYTHSON,Panama Cross-Grain Leather Briefcase,1695,accessories
BRUNELLO CUCINELLI,Ribbed Cashmere Beanie,495,accessories
BOTTEGA VENETA EYEWEAR,D-Frame Gold-Tone Sunglasses,455,accessories
BALENCIAGA,Explorer Distressed Camouflage-Print Canvas Backpack,1200,accessories
ROXANNE ASSOULIN,Gold-Tone and Enamel Beaded Necklace,120,accessories
FENDI EYEWEAR,Sky Metal Round-Frame Sunglasses,510,accessories
LORO PIANA,Cable-Knit Baby Cashmere Scarf,875,accessories
GUCCI,3.5cm Reversible Monogrammed Leather Belt,570,accessories
MIANSAI,Amit Silver Chain Necklace,105,accessories
FAVOURBROOK,Pre-Tied Duchesse Silk-Satin Bow Tie,85,accessories
LUIS MORAIS,"Gold, Enamel, Tiger's Eye and Sapphire Beaded Bracelet",282,accessories
BERLUTI,Venezia Leather Billfold Wallet,740,accessories
PAUL SMITH,Three-Pack Striped Cotton-Blend No-Show Socks,75,accessories
THROWING FITS,Logo-Embroidered Cotton-Blend Twill Baseball Cap,50,accessories
PAUL SMITH,Albert Colour-Block Cable-Knit Socks,40,accessories
LORO PIANA,Intarsia Cashmere Scarf,975,accessories
HATTON LABS,XL Pebbles Silver Pearl Bracelet,365,accessories
MONCLER GENIUS,+ adidas Originals Appliquéd Logo-Jacquard Nylon Baseball Cap,275,accessories
GUCCI,Ophidia Leather-Trimmed Monogrammed Coated-Canvas Duffle Bag,2750,accessories
FERRAGAMO,8cm Printed Silk-Twill Tie,210,accessories
CELINE HOMME,Logo-Print Croc-Effect Leather Billfold Wallet,560,accessories
VALENTINO GARAVANI,VLOGO Gold-Tone Chain Bracelet,650,accessories
GLOBE-TROTTER,125th Anniversary Leather-Trimmed Carry-On Suitcase,4445,accessories
DIOR EYEWEAR,CD Diamond S5I D-Frame Acetate and Silver-Tone Sunglasses,660,accessories
ÉLIOU,Harbour Gold-Plated Wood Necklace,160,accessories
LUIS MORAIS,"Gold, Enamel and Lapis Lazuli Bracelet",425,accessories
PAUL SMITH,Signature Stripe Cashmere and Wool-Blend Baseball Cap,175,accessories
DUNHILL,Rollagas Quilted Leather Tote Bag,1795,accessories
NEIGHBORHOOD,+ SRL 10-Pack Logo-Print Coated-Mesh Gloves,40,accessories
AHLEM,Marcadet Hexagonal-Frame Acetate Sunglasses,525,accessories
GIVENCHY,G-Trek Logo-Print Webbing-Trimmed Shell Wash Bag,625,accessories
COTOPAXI,Allpa Shell Backpack,200,accessories
PURDEY,Ribbed Cashmere Scarf,505,accessories
ALICE MADE THIS,Bayley Quink Gold-Tone Cufflinks,240,accessories
PASADENA LEISURE CLUB,Logo-Embroidered Cotton-Twill Baseball Cap,75,accessories
BALENCIAGA,Le Cagole Embellished Textured-Leather Messenger Bag,1850,accessories
CHRISTIAN LOUBOUTIN,City Studded Leather Pouch,1290,accessories
BLUE BLUE JAPAN,Kobolevi Printed Indigo-Dyed Cotton Bandana,20,accessories
CARHARTT WIP,Jake Hip Logo-Appliquéd Canvas Belt Bag,60,accessories
BOTTEGA VENETA,Intrecciato Leather Pouch,2900,accessories
CELINE HOMME,Silk-Jacquard Scarf,300,accessories
KENZO,Large Embroidered Leather-Trimmed Raffia Tote Bag,590,accessories
BEAMS PLUS,Intarsia Stretch Cotton-Blend Socks,30,accessories
ALICE MADE THIS,Dot Stainless Steel Cufflinks,150,accessories
LOEWE,Anagram Leather Key Fob,390,accessories
BERLUTI,Tersio Scritto Panelled Venezia Leather Pouch,2200,accessories
CHRISTIAN LOUBOUTIN,Cabalou Perforated Leather Tote Bag,1690,accessories
MIKIA,Silver Multi-Stone Beaded Bracelet,150,accessories
SIMONE ROCHA,Daisy Gold-Tone Crystal Bracelet,270,accessories
A.P.C.,Sacha Ribbed Merino Wool and Cashmere-Blend Balaclava,165,accessories
ALEXANDER MCQUEEN,The Knuckle Embellished Croc-Effect Leather Pouch,2290,accessories
BOTTEGA VENETA,Intrecciato Cord and Mesh Backpack,3200,accessories
MASTER-PIECE,Rise Ver.2 3way Leather-Trimmed Mastertex-09 Tote Bag,425,accessories
SAINT LAURENT,Silver-Tone and Leather Bracelet,695,accessories
JACQUEMUS,Le Bambino De Voyage Shell Weekender Bag,975,accessories
TOM FORD,Pleated Silk-Satin Cummerbund,490,accessories
BENNETT WINCH,Leather-Trimmed Suede Tote Bag,1100,accessories
FENDI EYEWEAR,Shadow Square-Frame Acetate Sunglasses,500,accessories
MIKIA,Silver Turquoise Beaded Bracelet,165,accessories
PAUL SMITH,Striped Leather Cardholder,175,accessories
ÉLIOU,Erec Silver Onyx Necklace,180,accessories
STORY MFG.,Tea Crocheted Organic Cotton Scarf,375,accessories
TOM FORD,Camouflage-Print Full-Grain Leather Pouch,1690,accessories
SAINT LAURENT,Cassandre Logo-Embossed Leather Billfold Wallet,395,accessories
PORTER-YOSHIDA & CO,Monogrammed Nylon Backpack,695,accessories
TOM FORD EYEWEAR,Round-Frame Tortoiseshell Acetate Sunglasses,525,accessories
JACQUES MARIE MAGE,+ The Gonzo Foundation Duke Aviator-Style Tortoiseshell Acetate and Silver-Tone Sunglasses,995,accessories
WACKO MARIA,Skater Type 3 Striped Ribbed Cotton-Blend Socks,25,accessories
KENZO,3cm Reversible Leather Belt,335,accessories
HATTON LABS,"Silver, Pearl and Cubic Zirconia Tennis Bracelet",780,accessories
BERLUTI,Un Jour Mini Scritto Venezia Leather Briefcase,3850,accessories
GUCCI,Leather-Trimmed Monogrammed Canvas Baseball Cap,460,accessories
NEIGHBORHOOD,3.2cm GI Woven Belt,75,accessories
EPPERSON MOUNTAINEERING,Medium Climb Webbing-Trimmed CORDURA® Backpack,220,accessories
TOM FORD,Full-Grain Leather Billfold Wallet,520,accessories
TOM FORD,Logo-Appliquéd Full-Grain Leather Bifold Cardholder,490,accessories
SAINT LAURENT,Logo-Jacquard Striped Fringed Silk Scarf,750,accessories
KINGSMAN,+ Drake's 8cm Silk-Grenadine Tie,225,accessories
SAINT LAURENT,Logo-Print Pebble-Grain Leather Billfold Wallet,450,accessories
SMYTHSON,Panama Cross-Grain Leather Envelope Folio,470,accessories
BOTTEGA VENETA,Cassette Mini Intrecciato Leather Messenger Bag,2400,accessories
DIOR EYEWEAR,Blacksuit Tortoiseshell Acetate and Silver-Tone Aviator-Style Optical Glasses,460,accessories
BRUNELLO CUCINELLI,Borsa Leather-Trimmed Canvas Weekend Bag,4995,accessories
FENDI EYEWEAR,Silver-Tone and Acetate D-Frame Sunglasses,420,accessories
MAISON MARGIELA,Glam Slam Logo-Appliquéd Padded Leather-Trimmed CORDURA® Backpack,1350,accessories
BALENCIAGA,+ adidas Distressed Logo-Embroidered Cotton-Twill Baseball Cap,425,accessories
JACQUES MARIE MAGE,Vasco Square-Frame Silver-Tone Sunglasses,850,accessories
MAISON KITSUNÉ,Logo-Appliquéd Cotton-Twill Baseball Cap,120,accessories
FOLK,Cotton-Canvas Baseball Cap,90,accessories
TOM FORD,Knitted Silk Tie,270,accessories
CELINE HOMME,D-Frame Acetate Sunglasses,460,accessories
SÉFR,Big Fringed Checked Brushed Wool-Blend Scarf,200,accessories
MASTER-PIECE,Slick Logo-Appliquéd Leather and CORDURA® Ballistic Nylon Messenger Bag,120,accessories
SAINT LAURENT EYEWEAR,Round-Frame Acetate Optical Glasses,460,accessories
MIANSAI,Otis Gold Vermeil and Jasper Pendant Necklace,165,accessories
PAUL SMITH,8cm Striped Wool and Silk-Blend Tie,175,accessories
MIANSAI,Remi Gold Vermeil Lapis Lazuli Necklace,145,accessories
FILSON,Dry Roll-Top Shell Tote Bag,215,accessories
BRUNELLO CUCINELLI,8cm Silk-Jacquard Tie,295,accessories
BLUE BLUE JAPAN,Intarsia-Knit Cotton-Blend Socks,15,accessories
BOTTEGA VENETA,Avenue B. Intreciatto Leather Pouch,2800,accessories
GUCCI,Leather-Trimmed Monogrammed Coated-Canvas Messenger Bag,1390,accessories
BRUNELLO CUCINELLI,Logo-Print Full-Grain Leather Duffle Bag,4995,accessories
ACNE STUDIOS,Logo-Embossed Suede-Trimmed Nylon-Ripstop Laptop Case,310,accessories
MAISON MARGIELA,Logo-Engraved Silver-Tone Cuff,380,accessories
AHLEM,Champ de Mars D-Frame Acetate Sunglasses,500,accessories
SAINT LAURENT,Logo-Print Upcycled Cross-Grain Leather Cardholder,295,accessories
ACNE STUDIOS,Amamel Teddy Silver-Tone Single Earring,220,accessories
MIANSAI,Snap Gold Vermeil Chain Bracelet,185,accessories
GUCCI,Fringed Logo-Jacquard Wool Scarf,670,accessories
EPPERSON MOUNTAINEERING,Climb Webbing-Trimmed CORDURA® Tote Bag,120,accessories
BOTTEGA VENETA,Cassette Intrecciato Leather Bifold Cardholder with Money Clip,600,accessories
RANDY'S GARMENTS,Logo-Appliqued Ribbed-Knit Beanie,35,accessories
MIANSAI,Nuts and Bolts Gold Single Earring,50,accessories
BURBERRY,Checked Shell Belt Bag,970,accessories
FILSON,Original Leather-Trimmed Twill Briefcase,495,accessories
BLUE BLUE JAPAN,Logo-Appliqued Mélange Wool-Blend Beanie,65,accessories
BURBERRY,Logo-Embroidered Shell Baseball Cap,440,accessories
PORTER-YOSHIDA & CO,Tanker Nylon Messenger Bag,240,accessories
ROSTERSOX,Ribbed Cotton Socks,35,accessories
ROSTERSOX,Tie-Dyed Ribbed Cotton Socks,35,accessories
A.P.C.,Camden Logo-Print Faux Leather-Trimmed Shell Tote,285,accessories
KENZO,Logo-Embossed Leather Zip-Around Cardholder,180,accessories
BALENCIAGA,Full-Grain Leather Camera Bag,1590,accessories
BERLUTI,Nino Scritto Venezia Leather Pouch,710,accessories
CHRISTIAN LOUBOUTIN,Logo-Appliquéd Leather Billfold Wallet,490,accessories
INDISPENSABLE,Logo-Print ECONYL® Messenger Bag,85,accessories
YMC,Logo-Embroidered Cotton and Linen-Blend Corduroy Baseball Cap,130,accessories
BURBERRY,Logo-Embroidered Gabardine Tote Bag,1950,accessories
MIANSAI,Scatola Huggie Logo-Engraved Sterling Silver Single Hoop Earring,50,accessories
ACNE STUDIOS,Suede-Trimmed Nylon-Ripstop Messenger Bag,220,accessories
MIKIA,Bandana Cotton Bracelet,175,accessories
AHLEM,Rue Saint Dominique D-Frame Acetate Sunglasses,485,accessories
GUCCI,Webbing-Trimmed Monogrammed Canvas Baseball Cap,460,accessories
ÉLIOU,"Jengo Silver, Pearl and Glass Beaded Necklace",150,accessories
NORSE PROJECTS,Bjarki Striped Two-Tone Cotton-Blend Socks,30,accessories
SERAPIAN,Stepan 72 Leather-Trimmed Logo-Embossed Coated-Canvas Messenger Bag,850,accessories
MIANSAI,Lynx Rhodium-Plated Gold Vermeil Chain Necklace,105,accessories
TOM FORD,Full-Grain Leather Wash Bag,1100,accessories
GIVENCHY,G-Essentials Leather-Trimmed Logo-Embossed Coated-Canvas Messenger Bag,1150,accessories
TOM FORD,8.5cm Silk-Jacquard Tie,310,accessories
TOM FORD,8.5cm Silk Tie,310,accessories
CELINE HOMME,Bob Logo-Print Cotton-Jersey Bucket Hat,395,accessories
SAINT LAURENT,Cassandre Logo-Appliquéd Croc-Effect Leather Pouch,825,accessories
HATTON LABS,Classic Silver Pearl Bracelet,300,accessories
GUCCI EYEWEAR,Aviator-Style Acetate Optical Glasses,465,accessories
ACNE STUDIOS,Baker Out Small Logo-Print Leather and Nylon Tote Bag,490,accessories
CUTLER AND GROSS,1387 Square-Frame Tortoiseshell Acetate Sunglasses,625,accessories
PEARLS BEFORE SWINE,Taeus Silver Sapphire Bracelet,435,accessories
LORO PIANA,Fringed Checked Cashmere Scarf,1050,accessories
BALENCIAGA,Distressed Full-Grain Leather Messenger Bag,1500,accessories
BOTTEGA VENETA,Sterling Silver Chain Necklace,800,accessories
ERL,Jacquard-Knit Cotton-Blend Fleece Beanie,120,accessories
KAPITAL,Fastcolor Patchwork Printed Selvedge Cotton-Voile Bandana,45,accessories
CELINE HOMME,Logo-Print Leather Cardholder,310,accessories
NEIGHBORHOOD,Vertical Mini Logo-Appliquéd CORDURA® Pouch,75,accessories
BALENCIAGA,Le Cagole Textured-Leather Pouch,1050,accessories
ACNE STUDIOS,Andemer Waxed-Canvas Messenger Bag,420,accessories
MULBERRY,Logo-Embossed Full-Grain Leather and Silver-Tone Keyring,145,accessories
PERSOL,Steve McQueen D-Frame Folding Acetate Sunglasses,447,accessories
M.COHEN,Perihelion Sterling Silver Chain Necklace,1750,accessories
SAINT LAURENT,Frayed Striped Silk-Twill Scarf,995,accessories
BOTTEGA VENETA,Intrecciato Leather Weekend Bag,4500,accessories
SAINT LAURENT,Cassandre Croc-Effect Leather and Silver-Tone Bracelet,370,accessories
ACNE STUDIOS,Suede-Trimmed Distressed Denim Tote,390,accessories
BURBERRY,Checked Leather-Trimmed Cotton-Blend Canvas Keyring,410,accessories
NORSE PROJECTS,Bjarki Neps Ribbed-Knit Socks,25,accessories
GUCCI EYEWEAR,+ Harry Styles HA HA HA Pince-Nez Round-Frame Gold-Tone Sunglasses,825,accessories
OFF-WHITE,Printed Leather Cardholder,270,accessories
BALENCIAGA EYEWEAR,Tag 2.0 Aviator-Style Gunmetal-Tone Sunglasses,435,accessories
ACNE STUDIOS,Logo-Appliquéd Ribbed Wool Beanie,170,accessories
PORTER-YOSHIDA & CO,Senses Nylon Backpack,910,accessories
MÉTIER,Closer Weekend Full-Grain Leather Holdall,4750,accessories
BALENCIAGA,Le Cagole Embellished Textured-Leather Messenger Bag,2600,accessories
BERLUTI,E'Mio Scritto Venezia Leather Briefcase,4400,accessories
LOEWE,Logo-Appliquéd Cotton-Corduroy Baseball Cap,550,accessories
GIVENCHY,Reversible Logo-Jacquard Wool Beanie,360,accessories
BURBERRY,Wool-Blend Fleece-Trimmed Cotton-Twill Trapper Cap,630,accessories
NEEDLES,Gold-Plated Pendant Necklace,245,accessories
TOM FORD,Round-Frame Tortoiseshell Acetate Sunglasses,475,accessories
LUIS MORAIS,"14-Karat Gold, Lapis Lazuli, Malachite and Cord Bracelet",560,accessories
BERLUTI,Toujours Scritto Venezia Leather-Trimmed Denim Tote Bag,2220,accessories
CORRIDOR,Ribbed Brushed-Knit Beanie,95,accessories
MIANSAI,Kai Silver Carnelian Beaded Bracelet,115,accessories
SERAPIAN,Stepan Logo-Embossed Coated-Canvas and Leather Billfold Wallet,340,accessories
LANVIN,Platinum-Plated Silver Enamel Pendant Necklace,675,accessories
RICK OWENS,Shielding D-Frame Studded Stainless Steel Sunglasses,680,accessories
GUCCI,Fringed Logo-Jacquard Wool and Silk-Blend Scarf,570,accessories
CELINE HOMME,Drummed Leather Tote Bag,2100,accessories
PORTER-YOSHIDA & CO,Platoon Camouflage-Print Ripstop Tote Bag,444,accessories
LUIS MORAIS,"Gold, Enamel, Glass and Pearl Beaded Necklace",865,accessories
BOTTEGA VENETA,Cassette Intrecciato Shell Wash Bag,1750,accessories
BENNETT WINCH,Commuter Leather-Trimmed Suede Holdall,1950,accessories
JACQUES MARIE MAGE,Plaza D-Frame Tortoiseshell Acetate Sunglasses,875,accessories
DE BONNE FACTURE,CP06 Wool-Bouclé Baseball Cap,165,accessories
BRUNELLO CUCINELLI,Embroidered Cotton-Gabardine Baseball Cap,595,accessories
STORY MFG.,Deepity Frayed Striped Crochet-Knit Organic Cotton Scarf,480,accessories
PEYOTE BIRD,Kilim Gold-Plated Multi-Stone Beaded Wrap Bracelet,395,accessories
CARTIER EYEWEAR,Aviator-Style Leather-Trimmed Gold-Tone and Acetate Sunglasses,3545,accessories
OFF-WHITE,Catalina Square-Frame Tortoiseshell Acetate Sunglasses,330,accessories
MISSONI,Fringed Striped Crocheted Cotton Scarf,155,accessories
GUCCI,Ophidia Mini Leather-Trimmed Monogrammed Coated-Canvas Messenger Bag,1590,accessories
LUIS MORAIS,"Gold, Diamond and Glass Beaded Bracelet",244,accessories
FILSON,Harvester Logo-Appliquéd Twill and Mesh Trucker Cap,75,accessories
TOM FORD,Pre-Tied Velvet Bow Tie,270,accessories
NEIGHBORHOOD,Three-Pack Striped Ribbed Cotton-Blend Socks,50,accessories
MONCLER GENIUS,+ 1017 ALYX 9SM Logo-Appliquéd Ribbed Wool Beanie,330,accessories
DIOR EYEWEAR,Dior90 A1U Aviator-Style Silver-Tone Sunglasses,740,accessories
LANVIN,Platinum-Plated Tie Bar,245,accessories
MIANSAI,Remi Rhodium-Plated Spinel Pendant Necklace,135,accessories
CARTIER EYEWEAR,Frameless Silver-Tone Optical Glasses,1595,accessories
FILSON,Ballard Logo-Appliquéd Ribbed-Knit Beanie,30,accessories
PAUL SMITH,Embroidered Leather Gloves,220,accessories
CHRISTIAN LOUBOUTIN,Studded Leather and Rubber Tote,1450,accessories
KAPITAL,Thumb Up Appliquéd Leather Zip-Around Wallet,270,accessories
BALENCIAGA,Le Cagole Embellished Textured-Leather Messenger Bag,1800,accessories
THE ELDER STATESMAN,Striped Ribbed Cashmere Beanie,510,accessories
CHRISTIAN LOUBOUTIN,Backparis Spiked Rubber-Trimmed Full-Grain Leather Backpack,1850,accessories
VALENTINO GARAVANI,Rockstud Gold-Tone and Leather Bracelet,370,accessories
PEARLS BEFORE SWINE,Klon Silver Pendant Necklace,300,accessories
SULKA,Fringed Silk-Twill Scarf,545,accessories
MONTBLANC,M Lock 4810 3.5cm Full-Grain Leather Belt,490,accessories
GALLERY DEPT.,Printed Canvas and Mesh Cap,120,accessories
HATTON LABS,XL Rose Silver Cubic Zirconia Chain Bracelet,1515,accessories
BOTTEGA VENETA,Intrecciato Full-Grain Leather Billfold Wallet,690,accessories
LE GRAMME,9G Brushed Sterling Silver and 18-Karat Gold Cable Bracelet,1395,accessories
LORO PIANA,Ribbed Cashmere Scarf,795,accessories
GUCCI EYEWEAR,D-Frame Acetate Sunglasses,390,accessories
LANVIN,Polka-Dot Silk-Twill Pocket Square,90,accessories
ÉLIOU,"Drew Gold-Plated, Resin and Cord Bracelet",140,accessories
BERLUTI,Scritto Arabesque Frayed Mulberry Silk and Cashmere-Blend Jacquard Scarf,590,accessories
CANALI,8cm Printed Silk Tie,145,accessories
LOEWE,+ Paula's Ibiza Logo-Embroidered Raffia Tote Bag,1600,accessories
BURBERRY,Logo-Embellished Full-Grain Leather Messenger Bag,2090,accessories
ACNE STUDIOS,Logo-Embossed Suede-Trimmed Ripstop Backpack,380,accessories
GUCCI,Monogrammed Full-Grain Leather Wallet,580,accessories
ETRO,8cm Silk-Jacquard Tie,220,accessories
GIVENCHY,Muffler Logo-Jacquard Wool Scarf,340,accessories
LORO PIANA,Archie Leather and Suede Gloves,750,accessories
BRUNELLO CUCINELLI,Vitello Nuvolato Logo-Print Leather Duffle Bag,4395,accessories
LE GRAMME,21g Brushed Sterling Silver Cuff,475,accessories
JOHNSTONS OF ELGIN,Ribbed Cashmere Socks,120,accessories
GUCCI,Leather-Trimmed Monogrammed Cotton-Blend Canvas Bucket Hat,570,accessories
BOTTEGA VENETA,Intrecciato Padded Shell Messenger Bag,2900,accessories
FENDI EYEWEAR,Sky Metal Round-Frame Sunglasses,550,accessories
DENTS,Rolleston Touchscreen Leather Gloves,185,accessories
SERAPIAN,Stepan Logo-Embossed Coated-Canvas and Leather Cardholder,190,accessories
PAUL SMITH,8cm Silk-Grenadine Tie,150,accessories
GUCCI,Gucci Dive Stainless Steel Watch,2250,accessories
MÉTIER,Closer Weekend Suede Holdall,4950,accessories
LANVIN,Logo-Print Silk-Twill Pocket Square,85,accessories
HATTON LABS,"Silver, Pearl and Cubic Zirconia Necklace",1745,accessories
CELINE HOMME,Convertible Square-Frame Silver-Tone and Acetate Optical Glasses,510,accessories
MIANSAI,Lynx Rhodium-Plated Chain Necklace,85,accessories
CHRISTIAN LOUBOUTIN,For Rui Leather Pouch,1090,accessories
BOTTEGA VENETA EYEWEAR,D-Frame Acetate Sunglasses,485,accessories
MONTBLANC,Extreme 3.0 Cross-Grain Leather Cardholder,290,accessories
ROXANNE ASSOULIN,"Glass, Faux Pearl and Gold-Tone Beaded Necklace",75,accessories
GUCCI EYEWEAR,Rimless Rectangular-Frame Gold-Tone and Acetate Sunglasses,565,accessories
SMYTHSON,Panama Cross-Grain Leather Cardholder,235,accessories
GIVENCHY,G-Trek Logo-Print Shell Backpack,850,accessories
MONCLER,Logo-Appliquéd CORDURA® Belt Bag,680,accessories
DUNHILL,9cm Striped Linen and Mulberry Silk-Blend Twill Tie,270,accessories
DUNHILL,1893 Harness Full-Grain Leather Silver-Tone Key Case,375,accessories
ROXANNE ASSOULIN,The Line Set of Two Gold-Tone and Enamel Necklaces,130,accessories
GIVENCHY,Logo-Embroidered Cotton-Blend Twill Baseball Cap,500,accessories
MULBERRY,Medium Clipper Leather-Trimmed Scotchgrain Holdall,1365,accessories
FERRAGAMO,7cm Logo-Embroidered Silk-Faille Tie,205,accessories
LE GRAMME,Le 21 Brushed Ruthenium-Plated Sterling Silver Cuff,435,accessories
NORSE PROJECTS,Bjarki Mélange Cotton-Blend Socks,25,accessories
THE ROW,3cm Leather Belt,595,accessories
LANVIN,Colour-Block Silk-Twill Pocket Square,90,accessories
GUCCI,Leather-Trimmed Monogrammed Coated-Canvas Wash Bag,920,accessories
SAINT LAURENT,Sac De Jour Full-Grain Leather Tote Bag,2950,accessories
ROSTERSOX,Ribbed Printed Cotton-Blend Socks,35,accessories
MARNI,+ No Vacancy Inn Printed Canvas Tote Bag,765,accessories
LOEWE,Puzzle Logo-Debossed Leather Messenger Bag,3900,accessories
SAINT LAURENT,Gold-Tone Money Clip,245,accessories
BRUNELLO CUCINELLI EYEWEAR,Jep Convertible D-Frame Tortoiseshell Acetate and Gold-Tone Optical Glasses,642,accessories
LOEWE,Anagram Logo-Appliquéd Fringed Logo-Print Knitted Scarf,690,accessories
GIVENCHY,Logo-Print Coated-Canvas and Leather Zipped Cardholder,290,accessories
MR P.,Ribbed Space-Dyed Cotton-Blend Socks,40,accessories
DIOR EYEWEAR,DiorBlackSuit XL S2U Square-Frame Tortoiseshell Acetate Sunglasses,520,accessories
STRAY RATS,Ratgirl Logo-Print Twill and Mesh Trucker Cap,50,accessories
PERSOL,Aviator-Style Tortoiseshell Acetate Sunglasses,395,accessories
MR P.,Ribbed Donegal Wool Scarf,140,accessories
SID MASHBURN,5.5cm Polka-Dot Knitted Silk Tie,95,accessories
GUCCI EYEWEAR,Rectangular-Frame Acetate Sunglasses,550,accessories
ALEXANDER MCQUEEN,The Knuckle Twisted Leather and Silver-Tone Messenger Bag,2590,accessories
MISSONI,Crochet-Knit Nylon Backpack,1120,accessories
PERSOL,Round-Frame Folding Acetate Sunglasses,590,accessories
GIVENCHY,4G Logo-Embroidered Wool Gloves,325,accessories
LE GRAMME,25g Polished Sterling Silver Bracelet,1230,accessories
GUCCI,Dive 40mm Stainless Steel Watch,2250,accessories
THE ROW,Billy Leather and Gold-Tone Key Fob,550,accessories
MONCLER GENIUS,7 Moncler FRGMT Hiroshi Fujiwara Logo-Appliquéd Ribbed Wool Beanie,400,accessories
LANVIN,Logo-Embroidered Silk-Twill Pocket Square,85,accessories
SAINT LAURENT EYEWEAR,D-Frame Recycled-Acetate Sunglasses,520,accessories
AMI PARIS,Logo-Embroidered Alpaca-Blend Beanie,195,accessories
ACNE STUDIOS,Vesuvio Logo-Appliquéd Fringed Alpaca-Blend Scarf,210,accessories
LORO PIANA,Ribbed Cashmere Scarf,750,accessories
NUDIE JEANS,Ribbed Wool Beanie,95,accessories
ACNE STUDIOS,Agoflus Engraved Silver-Tone Chain Bracelet,380,accessories
CANALI,8cm Silk-Jacquard Tie,145,accessories
MARNI,Brushed Striped Mohair-Blend Bucket Hat,555,accessories
BENNETT WINCH,Leather-Trimmed Cotton-Canvas Suit Carrier and Holdall,1350,accessories
HATTON LABS,Daisy Silver Cubic Zirconia Tennis Necklace,555,accessories
PAUL SMITH,Striped Leather Cardholder,195,accessories
ZEGNA X THE ELDER STATESMAN,Wool and Cashmere-Blend Felt Baseball Cap,590,accessories
CHRISTIAN LOUBOUTIN,Loubilink Studded Rubber Bracelet,250,accessories
OFF-WHITE,Lecce Rectangular-Frame Acetate Sunglasses,295,accessories
BOTTEGA VENETA,Avenue Intrecciato Leather Briefcase,4200,accessories
BOTTEGA VENETA,Intrecciato Rubber iPhone 14 Pro Max Case,250,accessories
LORO PIANA,Fringed Striped Linen Scarf,635,accessories
LORO PIANA,4cm Woven Suede Belt,690,accessories
LOEWE,Puzzle Small Leather Belt Bag,2300,accessories
FOLK,Crinkled Cotton-Canvas Baseball Cap,90,accessories
GIVENCHY EYEWEAR,'GV Speed Aviator-Style Metal Sunglasses,300,accessories
GUCCI,3.5cm Marmont Reversible Monogrammed Coated-Canvas Belt,570,accessories
BRUNELLO CUCINELLI,Logo-Embroidered Leather-Trimmed Cotton-Twill Baseball Cap,550,accessories
POP TRADING COMPANY,Logo-Embroidered Cotton-Twill Baseball Cap,70,accessories
SAINT LAURENT,A4 Pebble-Grain Leather Document Holder,695,accessories
KAPITAL,Intarsia Cotton-Blend Socks,40,accessories
LIBERAL YOUTH MINISTRY,Logo-Appliquéd Stretch-Knit Gloves,180,accessories
TOM WOOD,Rolo Rhodium-Plated Chain Bracelet,319,accessories
MR P.,Stretch Cotton-Blend Socks,40,accessories
SAINT LAURENT EYEWEAR,Rectangular-Frame Tortoiseshell Acetate Sunglasses,460,accessories
ÉLIOU,Nils Silver-Plated Necklace,250,accessories
GUCCI,Horsebit Leather-Trimmed Monogrammed Coated-Canvas Pouch,1050,accessories
TOM FORD,Logo-Embellished Full-Grain Leather Billfold Wallet,458,accessories
DIOR EYEWEAR,DiorBlackSuit S10I D-Frame Acetate Sunglasses,490,accessories
POP TRADING COMPANY,Logo-Embroidered Striped Ribbed-Knit Beanie,50,accessories
KAPITAL,Distressed Embroidered Patchwork Cotton-Twill and Shell Bucket Hat,355,accessories
EPPERSON MOUNTAINEERING,Large Climb Colour-Block Webbing-Trimmed Nylon Backpack,250,accessories
NEEDLES,Logo-Embroidered Ribbed Merino Wool Beanie,115,accessories
MÉTIER,Full-Grain Leather Document Holder,2150,accessories
CELINE HOMME,D-Frame Acetate Sunglasses,420,accessories
MONCLER GENIUS,7 Moncler FRGMT Hiroshi Fujiwara Logo-Appliquéd Shell Bucket Hat,455,accessories
KENZO,Crest Appliquéd Logo-Embroidered Canvas Belt Bag,295,accessories
KINGSMAN,+ Drake's Self-Tie Silk-Faille Bow Tie,145,accessories
GUCCI,Dive 40mm Automatic Stainless Steel and Rubber Watch,2100,accessories
BOTTEGA VENETA,3.5cm Intrecciato Leather Belt,720,accessories
NEEDLES,Silver-Tone and Onyx Beaded Necklace,285,accessories
CELINE HOMME,Quilted Leather Messenger Bag,3450,accessories
LOEWE,4cm Anagram Reversible Leather Belt,590,accessories
FILSON,Logger Camouflage-Print Cotton-Canvas and Mesh Trucker Hat,80,accessories
BURBERRY,Cason Leather-Trimmed Checked Coated-Canvas Belt Bag,860,accessories
CHRISTIAN LOUBOUTIN,Ruistote Recycled Textured-Shell Messenger Bag,890,accessories
MASTER-PIECE,Slick Logo-Appliquéd Leather and CORDURA® Barastec Nylon Sling Backpack,340,accessories
POLO RALPH LAUREN,Set of Six Logo-Embroidered Cotton-Blend Socks,50,accessories
CARTIER EYEWEAR,Aviator-Style Gold-Tone Titanium Optical Glasses,1295,accessories
FENDI EYEWEAR,Shadow Acetate Optical Glasses,500,accessories
GUCCI,Leather-Trimmed Monogrammed Coated-Canvas Tote Bag,2150,accessories
BURBERRY,Full-Grain Leather Messenger Bag,1890,accessories
CHARLES SIMON,Eaton Full-Grain Leather Three-Piece Travel Watch Case,1490,accessories
PASADENA LEISURE CLUB,Logo-Embroidered Cotton-Twill Baseball Cap,70,accessories
BALENCIAGA,Explorer Graffiti-Print Textured-Leather Backpack,2350,accessories
DIOR EYEWEAR,InDior S1I Square-Frame Acetate Sunglasses,390,accessories
SAINT LAURENT EYEWEAR,Square-Frame Gold-Tone Sunglasses,560,accessories
SAINT LAURENT,Full-Grain Leather Wash Bag,575,accessories
BALENCIAGA,Full-Grain Leather Camera Bag,1350,accessories
MÉTIER,Textured-Leather Pouch,1350,accessories
TOM FORD TIMEPIECES,002 40mm Stainless Steel Watch,2645,accessories
SAINT LAURENT,Sac de Jour Large Full-Grain Leather Tote Bag,3800,accessories
ANDERSON & SHEPPARD,6.5cm Knitted Silk Tie,115,accessories
BRUNELLO CUCINELLI,Printed Wool-Twill Pocket Square,240,accessories
BOTTEGA VENETA,3cm Intrecciato Leather Belt,590,accessories
FERRAGAMO,Full-Grain Leather Briefcase,2500,accessories
BOTTEGA VENETA,Intrecciato Leather Trifold Wallet,650,accessories
HATTON LABS,Tri-Set Silver Cubic Zirconia Tennnis Bracelet,345,accessories
