brand,description,price_usd,type
LOEWE,Fringed Logo-Embroidered Two-Tone Wool and Cashmere-Blend Scarf,450,accessories
DIOR EYEWEAR,Diamond R2I Acetate and Silver-Tone Round-Frame Sunglasses,730,accessories
DIOR EYEWEAR,DiorBlackSuit RI Round-Frame Acetate and Silver-Tone Sunglasses,550,accessories
ALEXANDER MCQUEEN,Studded Leather Cardholder,320,accessories
RICK OWENS,+ Champion Logo-Appliquéd Recycled-Shell Cap,135,accessories
LOEWE,Puzzle Large Two-Tone Leather Tote Bag,2450,accessories
ALICE MADE THIS,P8 Bancroft Sterling Silver Cuff,665,accessories
BOTTEGA VENETA,Intrecciato Leather Billfold Wallet with Money Clip,650,accessories
BALENCIAGA,Le Cagole Studded Crinkled-Leather Backpack,2750,accessories
TOM WOOD,Spike Gold-Plated Chain Bracelet,220,accessories
GUCCI,Leather-Trimmed Monogrammed Ripstop Messenger Bag,1680,accessories
BOTTEGA VENETA,3.5cm Reversible Intrecciato Leather Belt,850,accessories
LOEWE,Puzzle Edge Mini Leather Belt Bag,2100,accessories
JACQUEMUS,Logo-Appliquéd Cotton-Canvas Bucket Hat,125,accessories
DIOR EYEWEAR,CD Diamond S4U D-Frame Silver-Tone and Tortoiseshell Acetate Sunglasses,850,accessories
LOEWE,Elephant Pocket Leather Messenger Bag,890,accessories
MISSONI,Logo-Jacquard Striped Wool Scarf,460,accessories
GARRETT LEIGHT CALIFORNIA OPTICAL,Kinney Round-Frame Acetate Sunglasses,385,accessories
BOTTEGA VENETA,Intrecciato Large Embellished Leather Briefcase,6500,accessories
BOTTEGA VENETA,Intrecciato Padded Shell Messenger Bag,1900,accessories
GUCCI,Logo-Jacquard Wool and Silk-Blend Scarf,565,accessories
LUIS MORAIS,"Gold, Coral and Indian Agate Beaded Bracelet",430,accessories
LORO PIANA,Fringed Cashmere Scarf,585,accessories
JACQUES MARIE MAGE,Taos Square-Frame Acetate Sunglasses,750,accessories
BRUNELLO CUCINELLI,Leather Backpack,4995,accessories
TOM FORD,3cm Patent-Leather Belt,990,accessories
THE ROW,Clovis Leather-Trimmed Canvas Weekend Bag,1910,accessories
ELLIE MERCER,Sterling Silver and Resin Cuff,985,accessories
BRUNELLO CUCINELLI,Suede-Trimmed Cashmere Gloves,995,accessories
TOM FORD,Full-Grain Leather Belt Bag,2490,accessories
CELINE HOMME,Logo-Appliquéd Ribbed Wool Scarf,590,accessories
GALLERY DEPT.,Embellished Quilted Leather Belt Bag,2700,accessories
ELLIE MERCER,Sterling Silver and Resin Signet Ring,500,accessories
CARTIER EYEWEAR,Frameless Gold-Tone Sunglasses,1295,accessories
BOTTEGA VENETA,Intrecciato Padded Shell Briefcase,2900,accessories
LOEWE EYEWEAR,Curvy Round-Frame Acetate Sunglasses,310,accessories
A.P.C.,+ JW Anderson Fringed Knitted Scarf,335,accessories
LORO PIANA,Tamar Ribbed Herringbone Cashmere Scarf,1100,accessories
SAINT LAURENT,Full-Grain Leather Briefcase,1590,accessories
BRUNELLO CUCINELLI,Cotton-Blend Corduroy Baseball Cap,650,accessories
BERLUTI,3 Nuits Neo Scritto Venezia Leather Briefcase,5350,accessories
CARTIER EYEWEAR,Frameless Gold-Tone Sunglasses,1095,accessories
MR P.,3.5cm Woven Leather Belt,170,accessories
ANDERSON'S,4cm Burnished-Leather Belt,235,accessories
BURBERRY,Boston Leather-Trimmed Checked Coated-Canvas Duffle Bag,2390,accessories
RUBINACCI,Cashmere Gloves,195,accessories
CELINE HOMME,Triomphe Leather-Trimmed Logo-Print Coated-Canvas Backpack,1850,accessories
CELINE HOMME,Triomphe Leather-Trimmed Coated-Canvas Cardholder,295,accessories
CELINE HOMME,Alan Crystal-Embellished D-Frame Acetate Sunglasses,500,accessories
GUCCI,3cm Reversible Monogrammed Supreme Coated-Canvas and Full-Grain Leather Belt,570,accessories
FENDI EYEWEAR,Fendigraphy Square-Frame Acetate Sunglasses,510,accessories
GUCCI,Horsebit 1955 Leather-Trimmed Printed Coated-Canvas Shoulder Bag,1200,accessories
GALLERY DEPT.,Workshop Paint-Splattered Logo-Print Canvas and Mesh Trucker Cap,500,accessories
BOTTEGA VENETA,Intrecciato Padded Shell Messenger Bag,2500,accessories
SAINT LAURENT,Logo-Appliquéd Fringed Silk Scarf,395,accessories
BALENCIAGA EYEWEAR,Cat-Eye Acetate Sunglasses,820,accessories
GUCCI,Ophidia Leather and Monogrammed Coated-Canvas Billfold Wallet,450,accessories
TOM FORD,Day Fringed Logo-Embroidered Cashmere Scarf,920,accessories
ZEGNA,Leather-Trimmed Cashmere Beanie,390,accessories
JACQUES MARIE MAGE,Ashcroft Rectangular-Frame Acetate and Silver-Tone Sunglasses,750,accessories
GUCCI,Ophidia Medium Leather-Trimmed Monogrammed Coated-Canvas Messenger Bag,1850,accessories
SAINT LAURENT,Logo-Appliquéd Pebble-Grain Leather Bifold Wallet,425,accessories
THE ROW,Caspian Cashmere Baseball Cap,690,accessories
LOEWE,Goya Puffer Logo-Embellished Shell Messenger Bag,2500,accessories
ZEGNA,Logo-Embroidered Leather-Trimmed Cashmere Gloves,785,accessories
SAINT LAURENT,Logo-Debossed Padded Leather Tote Bag,3290,accessories
SAINT LAURENT EYEWEAR,Square-Frame Recycled-Acetate Sunglasses,545,accessories
MONCLER GENIUS,+ Palm Angels Logo-Appliquéd Ribbed Wool Beanie,320,accessories
ALEXANDER MCQUEEN,The Edge Full-Grain Leather Backpack,2990,accessories
ALEXANDER MCQUEEN,Silver-Tone and Faux Pearl Chain Bracelet,750,accessories
BOTTEGA VENETA,Intrecciato Leather Messenger Bag,7200,accessories
THE ROW,Gio Duffle Full-Grain Leather Weekend Bag,3900,accessories
LOEWE,Puzzle Small Leather Belt Bag,2400,accessories
BURBERRY,Leather-Trimmed Checked Wool Tote Bag,1650,accessories
GUCCI,Logo-Appliquéd Coated-Canvas and Mesh Trucker Hat,460,accessories
TOM FORD,4cm Reversible Full-Grain Leather Belt,790,accessories
GALLERY DEPT.,Logo-Print Canvas and Mesh Trucker Cap,120,accessories
TOM FORD,Full-Grain Leather Cardholder,390,accessories
TOM FORD,Full-Grain Leather Billfold Wallet,590,accessories
PEYOTE BIRD,"Sotogrande Gold-Plated, Turquoise and Chalcedony Necklace",2200,accessories
GALLERY DEPT.,Logo-Print Canvas and Mesh Trucker Cap,180,accessories
ACNE STUDIOS,Canada Fringed Cashmere Scarf,420,accessories
TOM FORD,Suede-Trimmed Full-Grain Leather Backpack,4490,accessories
GALLERY DEPT.,Logo-Embroidered Cotton-Twill Baseball Cap,210,accessories
GALLERY DEPT.,Printed Two-Tone Twill and Mesh Trucker Cap,195,accessories
MIANSAI,Valor Gold Spinel Pendant Necklace,825,accessories
KINGSMAN,+ Deakin & Francis Sterling Silver Mother-of-Pearl Cufflinks and Shirt Studs Set,680,accessories
STONE ISLAND,Logo-Appliquéd Crinkled-ECONYL® Cap,195,accessories
VISVIM,Leather-Trimmed CORDURA® Backpack,800,accessories
TOM FORD,7.5cm Knitted Silk Tie,183,accessories
BRUNELLO CUCINELLI,Ribbed Cashmere Socks,580,accessories
LOEWE,Logo-Debossed Full-Grain Leather Tote Bag,2300,accessories
BRUNELLO CUCINELLI,Ribbed Cashmere Socks,595,accessories
LOEWE,Puzzle Logo-Debossed Leather Zipped Cardholder,490,accessories
ACNE STUDIOS,Canada Fringed Wool Scarf,240,accessories
TOM FORD,Leather-Trimmed Recycled-Nylon Backpack,2990,accessories
TOM FORD,Full-Grain Leather Billfold Wallet with Money Clip,690,accessories
BERLUTI,2 Jour Neo Scritto Venezia Leather Briefcase,4450,accessories
CELINE HOMME,Logo-Embroidered Pinstriped Wool Hat,670,accessories
JOHN SMEDLEY,Cortland Colour-Block Ribbed Sea Island Cotton-Blend Socks,35,accessories
JACQUEMUS,Le Chiquito Logo-Embellished Mini Leather Bag,605,accessories
PORTER-YOSHIDA & CO,Tanker 3Way Nylon Briefcase,640,accessories
LOEWE,Cubi Leather Messenger Bag,1700,accessories
TOM FORD,Pebble-Grain Leather Backpack,4490,accessories
FPM MILANO,Bank Spinner 68cm Leather-Trimmed Aluminium Suitcase,2175,accessories
FPM MILANO,Bank Spinner 76cm Rubber-Trimmed Aluminium Suitcase,1850,accessories
TOM FORD,Full-Grain Leather Cardholder with Money Clip,580,accessories
TOM FORD,Logo-Embroidered Fringed Cashmere Scarf,920,accessories
CELINE HOMME,Logo-Embroidered Fringed Cashmere Scarf,550,accessories
CELINE HOMME,Logo-Appliquéd Cotton-Gabardine Cap,670,accessories
TOM FORD,Logo-Embellished Full-Grain Leather Bifold Cardholder,590,accessories
FILSON,Dryden Leather-Trimmed Cordura® Backpack,350,accessories
TOM FORD,Logo-Appliquéd Full-Grain Leather Cardholder,390,accessories
TOM FORD,4cm Reversible Full-Grain Leather Belt,850,accessories
MR P.,Houndstooth Jacquard-Knit Wool Scarf,170,accessories
TOM FORD,Camouflage-Print Full-Grain Leather Backpack,3990,accessories
AMI PARIS,Three-Pack Logo-Embroidered Ribbed Cotton-Blend Socks,135,accessories
BERLUTI,Formula 1005 Scritto Venezia Leather Suitcase,8500,accessories
FPM MILANO,Spinner 53cm Leather-Trimmed Aluminium Suitcase,1850,accessories
TOM FORD,3.5cm Full-Grain Leather Belt,1190,accessories
GLOBE-TROTTER,Centenary Check-In Leather-Trimmed Trolley Case,2595,accessories
BRUNELLO CUCINELLI,Full-Grain Leather Wash Bag,1250,accessories
TOM FORD,Ribbed Cashmere Beanie,440,accessories
BERLUTI,Rosewood Neo Venezia Scritto Leather Pouch,1375,accessories
TOM FORD,Leather-Trimmed Recycled Nylon Weekend Bag,3290,accessories
TOM FORD,Leather-Trimmed Recycled-Nylon Weekend Bag,3990,accessories
GLOBE-TROTTER,Centenary Leather-Trimmed Carry-On Suitcase,2195,accessories
FILSON,Twill and Leather Briefcase,550,accessories
KINGSMAN,+ Deakin & Francis Sterling Silver and Enamel Cufflinks,385,accessories
KINGSMAN,Ribbed Cashmere Socks,90,accessories
TOM FORD,Full-Grain Leather Bifold Wallet,620,accessories
TOM FORD,Leather-Trimmed Logo-Embroidered Cotton-Canvas Baseball Cap,695,accessories
VISVIM,Leather-Trimmed CORDURA® Nylon Backpack,800,accessories
TOM FORD,Suede-Trimmed Full-Grain Leather Weekend Bag,5490,accessories
ANDERSON'S,3.5cm Leather-Trimmed Woven Elastic Belt,195,accessories
ZEGNA X THE ELDER STATESMAN,Fringed Checked Cashmere Scarf,2950,accessories
KINGSMAN,+ Drake's 8cm Tussah Silk Tie,225,accessories
GLOBE-TROTTER,Centenary Leather-Trimmed Carry-On Suitcase,1865,accessories
RHUDE,+ Automobili Lamborghini Logo-Appliquéd Embroidered Suede-Trimmed Wool-Blend Trucker Cap,435,accessories
GLOBE-TROTTER,"Centenary 30"" Leather-Trimmed Suitcase",2995,accessories
FPM MILANO,Bank Spinner 55cm Rubber-Trimmed Aluminium Suitcase,1550,accessories
JACQUES MARIE MAGE,Dealan Square-Frame Acetate Sunglasses,750,accessories
FPM MILANO,Bank Spinner 76cm Leather-Trimmed Polycarbonate Suitcase,2275,accessories
CELINE HOMME,Triomphe Mini Leather-Trimmed Logo-Print Coated-Canvas Messenger Bag,1550,accessories
BRUNELLO CUCINELLI,Ribbed Cashmere Beanie,530,accessories
JACQUES MARIE MAGE,+ Diamond Cross Ranch Aviator-Style Gold-Tone Sunglasses,995,accessories
LUIS MORAIS,"Gold, Hematite and Enamel Beaded Bracelet",565,accessories
ACNE STUDIOS,Canada Logo-Detailed Fringed Cashmere Scarf,420,accessories
TOM FORD,Leather-Trimmed Recycled-Shell Pouch,1890,accessories
ACNE STUDIOS,Logo-Appliquéd Ribbed Wool Beanie,185,accessories
BERLUTI,Ivy Scritto Venezia Leather Pouch,1010,accessories
NORSE PROJECTS,Logo-Embroidered Cotton-Twill Baseball Cap,110,accessories
ACNE STUDIOS,Canada Narrow Fringed Wool Scarf,210,accessories
BRUNELLO CUCINELLI,Ribbed Cashmere Scarf,795,accessories
CELINE HOMME,Logo-Embroidered Cable-Knit Cashmere Scarf,990,accessories
ANDERSON'S,3cm Woven Leather Belt,210,accessories
KINGSMAN,+ Deakin & Francis Gold-Plated Enamel Cufflinks,385,accessories
MIANSAI,Mini Annex Gold Vermeil Chain Necklace,155,accessories
CHERRY LOS ANGELES,Logo-Embroidered Cotton-Twill Baseball Cap,80,accessories
LUIS MORAIS,"Gold, Enamel, Coral and Cord Bracelet",565,accessories
TOM FORD,Full-Grain Leather Cardholder,450,accessories
LOEWE,Puzzle Logo-Embossed Leather Billfold Wallet,550,accessories
MR P.,Lamaine Cable-Knit Wool Scarf,170,accessories
TOM FORD,2cm Croc-Effect Leather Belt,990,accessories
TOM FORD,Full-Grain Leather Belt,1750,accessories
FPM MILANO,Bank Spinner 84cm Aluminium Suitcase,1950,accessories
TOM FORD,Logo-Embossed Leather Messenger Bag,2422,accessories
ANDERSON'S,3.5cm Suede Belt,185,accessories
CELINE HOMME,Triomphe Leather-Trimmed Logo-Print Coated-Canvas Messenger Bag,1850,accessories
NORSE PROJECTS,Logo-Appliquéd Ribbed Merino Wool Beanie,100,accessories
LOEWE,Puzzle Large Panelled Leather Tote Bag,2300,accessories
STONE ISLAND,Logo-Embroidered Twill Baseball Cap,180,accessories
BRUNELLO CUCINELLI,"Wool, Cashmere and Silk-Blend Beanie",450,accessories
LUIS MORAIS,"Gold, Enamel, Turquoise and Cord Bracelet",565,accessories
JACQUES MARIE MAGE,+ Diamond Cross Ranch Aviator-Style Silver-Tone Sunglasses,995,accessories
MIANSAI,"+ Everett Williams Gold Vermeil, Agate and Sapphire Necklace",225,accessories
ANDERSON'S,3.5cm Leather Belt,180,accessories
KINGSMAN,8cm Silk-Jacquard Tie,225,accessories
BRUNELLO CUCINELLI,Full-Grain Leather Backpack,3540,accessories
PURDEY,Fringed Cashmere Scarf,890,accessories
PEYOTE BIRD,Soho Silver Multi-Stone Beaded Necklace,695,accessories
BERLUTI,Un Jour Mini Scritto Leather Briefcase,3850,accessories
ANDERSON'S,3.5cm Leather-Trimmed Woven Elastic Belt,175,accessories
ANDERSON'S,3.5cm Leather Belt,139,accessories
BOTTEGA VENETA,Cassette Intrecciato Denim Messenger Bag,2400,accessories
LORO PIANA,Logo-Embroidered Linen Baseball Cap,475,accessories
HORIZN STUDIOS,H7 Essential 77cm Polycarbonate Suitcase,560,accessories
CARTIER EYEWEAR,Aviator-Style Gold-Tone Sunglasses,1595,accessories
TOM FORD,Buckley Full-Grain Leather Briefcase,3890,accessories
CHARLES SIMON,Mackenzie Full-Grain Leather 10-Piece Travel Watch Case,8190,accessories
ANDERSON'S,3.5cm Leather-Trimmed Woven Elastic Belt,205,accessories
TOM FORD,Leather-Trimmed Shell Document Holder,1890,accessories
LE GRAMME,7g Braided Cord and Sterling Silver Bracelet,280,accessories
LUIS MORAIS,"Gold, Enamel, Diamond and Cord Bracelet",730,accessories
SAINT LAURENT,Logo-Embroidered Leather-Trimmed Shell Backpack,1850,accessories
ACNE STUDIOS,Elmas Logo-Print Leather Cardholder,180,accessories
MR P.,Lamaine Embroidered Wool Beanie,80,accessories
BRUNELLO CUCINELLI,Borsa Leather Duffle Bag,4900,accessories
CHRISTIAN LOUBOUTIN,Spiked Cotton-Canvas Hat,590,accessories
CELINE HOMME,Triomphe Mini Leather-Trimmed Monogrammed Coated-Canvas Messenger Bag,1500,accessories
BERLUTI,Working Day Scritto Venezia Leather Backpack,3765,accessories
ANDERSON'S,3.5cm Woven Leather Belt,250,accessories
AURALEE,Fringed Baby Cashmere Scarf,615,accessories
BERLUTI,Makore Neo Scritto Venezia Leather Billfold Wallet,780,accessories
MASTER-PIECE,Potential 3Way Convertible Leather and Canvas-Trimmed CORDURA®  MasterTeX Backpack,490,accessories
ROXANNE ASSOULIN,Dad Set of Two Silver-Tone and Enamel Beaded Bracelets,170,accessories
CELINE HOMME,Silver-Tone Cubic Zirconia Necklace,670,accessories
BURBERRY,Leather-Trimmed Checked Coated-Canvas Briefcase,1790,accessories
CHRISTIAN LOUBOUTIN,Bobino Spikes Leather-Trimmed Cotton-Canvas Bucket Hat,585,accessories
ACNE STUDIOS,Vally Two-Tone Checked Knitted Scarf,300,accessories
HATTON LABS,Silver Cubic Zirconia Tennis Bracelet,275,accessories
KAPITAL,The Old Man and the Sea Distressed Buckled Cotton-Twill Bucket Hat,320,accessories
TOM FORD,Full-Grain Leather Billfold Wallet,650,accessories
KINGSMAN,+ Deakin & Francis Rose Gold-Plated Enamel Cufflinks,385,accessories
RHUDE,Logo-Embroidered Nylon and Twill Baseball Cap,255,accessories
CELINE HOMME,Leopard-Print Cotton-Voile Scarf,300,accessories
HATTON LABS,Daisy Silver Cubic Zirconia Tennis Necklace,540,accessories
MIANSAI,+ Everett Williams Virgil Gold Vermeil Agate Pendant Necklace,155,accessories
JACQUES MARIE MAGE,+ Yellowstone Forever Dealan Square-Frame Acetate Sunglasses,895,accessories
GUCCI,Logo-Jacquard Ripstop Bucket Hat,590,accessories
BERLUTI,Un Jour Mini Venezia Leather Briefcase,4450,accessories
AURALEE,Brushed Mohair and Wool-Blend Beanie,300,accessories
ANDERSON'S,3.5cm Suede Belt,118,accessories
MR P.,Two-Pack Striped Ribbed Cotton-Blend Socks,60,accessories
LE GRAMME,5g Silver-Tone Polished-Ceramic Bracelet,540,accessories
BERLUTI,Jour Off Scritto Venezia Leather Weekend Bag,4950,accessories
GUCCI,Ophidia Leather-Trimmed Monogrammed Coated-Canvas Weekend Bag,2750,accessories
CELINE HOMME,Small Triomphe Leather-Trimmed Logo-Print Coated-Canvas Messenger Bag,1500,accessories
HORIZN STUDIOS,H6 Check-In 64cm Polycarbonate Suitcase,505,accessories
BERLUTI,Nino TGM Scritto Panelled Venezia Leather Pouch,2100,accessories
PORTER-YOSHIDA & CO,Tanker 2Way Nylon Duffle Bag,795,accessories
SAINT LAURENT,Niki Leather-Trimmed Nylon Messenger Bag,2690,accessories
ACNE STUDIOS,Canada Fringed Wool Scarf,210,accessories
FEAR OF GOD ESSENTIALS,Logo-Appliquéd Shell Baseball Cap,50,accessories
BRUNELLO CUCINELLI,Suede-Trimmed Full-Grain Leather Backpack,5395,accessories
BERLUTI,Nino Scritto Venezia Leather Pouch,1770,accessories
PORTER-YOSHIDA & CO,Tanker Nylon Backpack,450,accessories
MIANSAI,+ Everett Williams Silver and Onyx Pendant Necklace,195,accessories
LOEWE,+ Paula's Ibiza Canvas-Trimmed Raffia Tote Bag,1250,accessories
MR P.,3.5cm Leather Belt,125,accessories
LORO PIANA,Fringed Cashmere Scarf,450,accessories
TOM FORD,Croc-Effect Leather Bifold Wallet,690,accessories
HATTON LABS,Daisy Silver Cubic Zirconia Tennis Bracelet,345,accessories
C.P. COMPANY,Ribbed Merino Wool Beanie,190,accessories
MÉTIER,Full-Grain Leather Billfold Wallet,390,accessories
SAINT LAURENT,Manhattan Full-Grain Leather Tote Bag,4390,accessories
BOTTEGA VENETA,Embellished Intrecciato Leather Tote Bag,5300,accessories
TOM FORD,7.5cm Knitted Silk Tie,235,accessories
PAUL SMITH,Fringed cashmere scarf,275,accessories
MAISON KITSUNÉ,Palais Royal Logo-Print Cotton-Canvas Tote Bag,90,accessories
PORTER-YOSHIDA & CO,Tanker L Nylon Duffle Bag,405,accessories
KINGSMAN,+ Drake's Self-Tie Tussah Silk-Satin Bow Tie,145,accessories
CHRISTIAN LOUBOUTIN,Loubideal Leather-Trimmed Shell and Logo-Debossed Rubber Backpack,1790,accessories
JACQUEMUS,Le Cuerda Canvas-Trimmed Leather Pouch,605,accessories
LOEWE,Fringed Logo-Embroidered Two-Tone Wool and Cashmere-Blend Scarf,390,accessories
MIANSAI,Mini Annex Silver Chain Necklace,140,accessories
KAPITAL,Fastcolor Printed Selvedge Cotton-Voile Bandana,43,accessories
ZEGNA X THE ELDER STATESMAN,Fringed Checked Oasi Cashmere Scarf,1150,accessories
THE ELDER STATESMAN,Checked Cashmere and Silk-Blend Bouclé Beanie,620,accessories
STONE ISLAND,Logo-Appliquéd Ribbed Wool Beanie,230,accessories
GUCCI EYEWEAR,Square-Frame Recycled-Acetate Sunglasses,853,accessories
MONTBLANC,Meisterstück 4810 Textured-Leather Briefcase,1330,accessories
BRUNELLO CUCINELLI,Logo-Embroidered Cashmere and Cotton-Blend Neck Warmer,750,accessories
ACNE STUDIOS,Logo-Print Leather Trifold Cardholder,380,accessories
CELINE HOMME,Logo-Embroidered Leather-Trimmed Raffia Tote Bag,2100,accessories
FERRAGAMO,3.5cm Full-Grain Leather Belt,585,accessories
INIS MEÁIN,Ribbed Donegal Merino Wool and Cashmere-Blend Beanie,140,accessories
MIANSAI,Totem Silver Onyx Bracelet,550,accessories
BOTTEGA VENETA,Intrecciato Leather Messenger Bag,2900,accessories
ASPESI,Ribbed Wool Beanie,235,accessories
JOHNSTONS OF ELGIN,Striped Ribbed Cashmere Scarf,525,accessories
BERLUTI,Jour Scritto Panelled Venezia Leather Briefcase,4650,accessories
LOEWE,Logo-Appliquéd Cotton-Piqué Baseball Cap,450,accessories
ROXANNE ASSOULIN,Set of Two Silver-Tone Beaded Bracelets,180,accessories
TOM FORD,Colour-Block Full-Grain Leather Cardholder,420,accessories
TOM FORD,Colour-Block Full-Grain Leather Cardholder,410,accessories
SAINT LAURENT,Full-Grain Leather Backpack,2350,accessories
GALLERY DEPT.,Topanga Logo-Print Two-Tone Ribbed-Cotton Beanie,425,accessories
TOM FORD,7.5cm Knitted Silk Tie,310,accessories
MASTER-PIECE,Rise Ver.2 Leather-Trimmed Mastertex-09 Backpack,495,accessories
TOM FORD,Full-Grain Leather Cardholder,380,accessories
KINGSMAN,+ Drake's 8cm Polka Dot Silk-Grenadine Jacquard Tie,225,accessories
KINGSMAN,+ Drake's 8cm Silk-Jacquard Tie,225,accessories
TOM FORD,Woven Leather and Gold-Plated Wrap Bracelet,470,accessories
HARTFORD,Ribbed Wool and Cashmere-Blend Beanie,120,accessories
BRUNELLO CUCINELLI,Full-Grain Leather Billfold Wallet,550,accessories
MIANSAI,Venetian Gold Chain Bracelet,595,accessories
TOM FORD,Camouflage-Print Full-Grain Leather Cardholder,480,accessories
A KIND OF GUISE,Khoni Recycled-Nylon and Wool and Cotton-Blend Fleece Trapper Cap,190,accessories
GALLERY DEPT.,Logo-Print Cotton-Corduroy Tote Bag,495,accessories
MONCLER,Logo-Appliquéd Ribbed Virgin Wool and Cashmere-Blend Beanie,300,accessories
LE GRAMME,5g Brushed Ruthenium-Plated and Ceramic Bracelet,600,accessories
LOEWE,Logo-Appliquéd Padded Nylon Bucket Hat,690,accessories
ROXANNE ASSOULIN,Set of Two Gold-Tone and Enamel Beaded Bracelets,215,accessories
PORTER-YOSHIDA & CO,Tanker 2Way Nylon Tote Bag,460,accessories
LORO PIANA,Logo-Embroidered Storm System® Cotton-Blend Corduroy Baseball Cap,500,accessories
A.P.C.,Andre Logo-Print Leather Cardholder,130,accessories
MULBERRY,Medium Clipper Holdall,1365,accessories
INDISPENSABLE,Logo-Print ECONYL® Messenger Bag,375,accessories
LORO PIANA,Logo-Embroidered Storm System® Cashmere-Felt Baseball Cap,525,accessories
GUCCI,Full-Grain Leather-Trimmed Monogrammed ECONYL® Ripstop Duffle Bag,2950,accessories
BOTTEGA VENETA,Intrecciato Leather Duffle Bag,5900,accessories
MR P.,Leather Billfold Wallet,215,accessories
MISSONI,Wool-Jacquard Beanie,330,accessories
TOM FORD,Full-Grain Leather Cardholder,410,accessories
ANDERSON'S,3.5cm Woven Leather Belt,235,accessories
HORIZN STUDIOS,M5 Cabin Essential 55cm Polycarbonate and Nylon Suitcase,450,accessories
BALMAIN,Striped Mohair-Blend Beanie,695,accessories
PORTER-YOSHIDA & CO,Counter Shade Daypack Mesh-Panelled Camouflage-Print Nylon Backpack,685,accessories
KENZO,Jungle Logo-Appliquéd Webbing-Trimmed Tech-Twill Tote Bag,445,accessories
PORTER-YOSHIDA & CO,Tanker Short Helmet Nylon Tote Bag,285,accessories
KAPITAL,"Printed Canvas, Patchwork Denim and Mesh Trucker Cap",165,accessories
SAINT LAURENT,Leather-Trimmed Logo-Print Suede Duffle Bag,2290,accessories
TOM FORD,Camouflage-Print Full-Grain Leather Bifold Wallet,650,accessories
BURBERRY,Fringed Checked Wool and Cashmere-Blend Scarf,550,accessories
SAINT LAURENT,Sac De Jour Leather-Trimmed Canvas Tote Bag,3750,accessories
BRUNELLO CUCINELLI,Fleece-Lined Leather Gloves,1495,accessories
MONTBLANC,Sartorial Medium Cross-Grain Leather Backpack,1510,accessories
TOM FORD,7cm Silk-Jacquard Tie,350,accessories
MISSONI,Striped Mohair-Blend Scarf,630,accessories
GUCCI EYEWEAR,Aviator-Style Gunmetal-Tone Sunglasses,610,accessories
PORTER-YOSHIDA & CO,Senses 2Way Convertible Nylon Briefcase,705,accessories
CELINE HOMME,Logo-Print Textured-Leather Cardholder,325,accessories
KENZO,Crest Appliquéd Logo-Embroidered Canvas Backpack,425,accessories
PEYOTE BIRD,Copacabana Set of Two Gold-Plated Multi-Stone Beaded Bracelets,575,accessories
BOTTEGA VENETA,Intrecciato Leather Briefcase,4400,accessories
THOM BROWNE,Hector Pebble-Grain Leather Tote Bag,2600,accessories
KAPITAL,The Old Man and the Sea Distressed Buckled Cotton-Twill Bucket Hat,200,accessories
VALENTINO GARAVANI,Rockstud Leather Pouch,1320,accessories
JIL SANDER,Tangle Medium Leather Messenger Bag,1280,accessories
POLO RALPH LAUREN,Logo-Embroidered Cotton-Twill Baseball Cap,60,accessories
JACQUES MARIE MAGE,Jeff Square-Frame Acetate and Gold-Tone Sunglasses,850,accessories
VALENTINO GARAVANI,Logo-Appliquéd Leather Messenger Bag,2590,accessories
LORO PIANA,Elite Fringed Cashmere Scarf,1195,accessories
FILSON,48 Hour Leather-Trimmed Waxed Cotton-Canvas Duffle Bag,495,accessories
ROXANNE ASSOULIN,Set of Two Gold-Tone and Enamel Bracelets,200,accessories
MONCLER,Logo-Appliquéd Ribbed Virgin Wool and Cashmere-Blend Beanie,340,accessories
HORIZN STUDIOS,H5 Cabin Essential 55cm Polycarbonate Suitcase,395,accessories
CELINE HOMME,Full-Grain Leather Billfold Wallet,530,accessories
BRUNELLO CUCINELLI,Croc-Effect Leather Billfold Wallet,2595,accessories
NUDIE JEANS,Striped Ribbed Cotton-Blend Socks,25,accessories
BRUNELLO CUCINELLI,Two-Tone Leather Weekend Bag,5995,accessories
LANVIN,Platinum-Plated Cufflinks,515,accessories
BOTTEGA VENETA,Intrecciato Leather Messenger Bag,2500,accessories
STORY MFG.,Crocheted Organic Cotton Bucket Hat,225,accessories
BOTTEGA VENETA,Intrecciato Leather Messenger Bag,5100,accessories
GLOBE-TROTTER,Centenary 26'' Leather-Trimmed Suitcase,2205,accessories
PORTER-YOSHIDA & CO,Counter Shade 3Way Camouflage-Print Nylon Briefcase,910,accessories
BERLUTI,Escape Scritto Venezia Softy Leather Backpack,4550,accessories
AMI PARIS,Logo-Appliquéd Fringed Alpaca-Blend Scarf,365,accessories
BERLUTI,Luti 38 Venezia Leather Tote Bag,4750,accessories
ACNE STUDIOS,Canada Fringed Wool Scarf,230,accessories
TOM FORD,Camouflage-Print Full-Grain Leather Messenger Bag,2420,accessories
MASSIMO ALBA,Clayde Mohair and Silk-Blend Beanie,225,accessories
RHUDE,Logo-Embroidered Shell Trucker Cap,255,accessories
GUCCI,Ophidia Leather-Trimmed Monogrammed Supreme Coated-Canvas Tote Bag,3100,accessories
BERLUTI,Jour Off Leather Weekend Bag,4050,accessories
OLIVER PEOPLES,Gregory Peck Round-Frame Acetate Sunglasses,485,accessories
THE ELDER STATESMAN,Whisper Ribbed Cashmere Beanie,415,accessories
CELINE HOMME,Triomphe Leather-Trimmed Monogrammed Coated-Canvas Pouch,650,accessories
BRUNELLO CUCINELLI,Full-Grain Leather Cardholder,450,accessories
JOHNSTONS OF ELGIN,Reversible Fringed Striped Cashmere and Wool-Blend Scarf,275,accessories
LANVIN,Platinum-Plated Cufflinks,365,accessories
CELINE HOMME,2.5cm Triomphe Leather Belt,690,accessories
GLOBE-TROTTER,"Centenary 30"" Leather-Trimmed Suitcase",2545,accessories
FPM MILANO,Bank Spinner 68cm Leather-Trimmed Polycarbonate and Aluminium Suitcase,866,accessories
TOM FORD,3cm Woven Leather Belt,990,accessories
GUCCI EYEWEAR,D-Frame Recycled-Acetate Sunglasses,420,accessories
GUCCI,Leather-Trimmed Logo-Appliquéd Monogrammed Ripstop Messenger Bag,1680,accessories
BRUNELLO CUCINELLI,Winter Escape Full-Grain Leather Duffle Bag,5995,accessories
POLO RALPH LAUREN,Logo-Embroidered Ribbed Cashmere Beanie,95,accessories
TOM FORD,East West Leather-Trimmed Canvas Tote Bag,4650,accessories
MONTBLANC,Meisterstück Selection Soft 24/7 Leather Briefcase,2170,accessories
GIVENCHY,Logo-Embroidered Cotton-Blend Twill Baseball Cap,450,accessories
GARRETT LEIGHT CALIFORNIA OPTICAL,Hampton Round-Frame Acetate Sunglasses,385,accessories
